Відколи я така совісна я не можу зі спокойною душею звалити з пари,,,,,,
"Вот...все таки обдурили мене... обманули,а кажуть люди погані,а тут і голуби ще аферисти",,,,,,
В мене завтра свіданка,,,,,,
"Сірожа, віддай мамі семсят тищ!",,,,,,
"благаю, скажіть що робити, щоб припинити гризти собі  губи та щоки",,,,,,
"Пробачте мені таке нахабство, але Сократ дискутує погано",,,,,,
"Оце діалог з Трампом, ок.",,,,,,
Про перекладацтво і дурнощі | стрнґ,,,,,,
"Люди, що виступають за ""спасітєлєй страньі"" по типу Вакарчука, Садового, Гриценка, Міхо – вас мало обманювали?",,,,,,
Це логіка чи шо це взагалі,,,,,,
"Дивлюся #Динамо - #Стяуа з рос. коментатором, якщо цей ще раз скаже ""Бєлянда"" я його знайду",,,,,,
"це якісь диваки, які свої копійки в кишені порахувати не можуть.",,,,,,
ТО ШО ТАК ВАЖКО НАПИСАТИ ПАРУ РЕЧЕНЬ? чи послати якомога далі і не агрити своїми нормальниками. бісить.,,,,,,
'Де м''який знак',,,,,,
"Не бійтесь посилати на три літери людей, яким ви не потрібні.",,,,,,
Дід Мороз подаруй мені роботу,,,,,,
"Санта, я погано поводилась, тож принеси наркотіків плєз.",,,,,,
да доколє ж мені всілякі збоченці вк писатимуть? ._.,,,,,,
Я сюди лаяти всіх прийшла.,,,,,,
крала в магазині та кричала про статеві органи на вулиці,,,,,,
"Рус, шо ти вже там напрацував",,,,,,
"В періоди коли я пишу всіляку дурість в твітер, мені соромно писати дм-ки  мені здається, що вона мене засуджує",,,,,,
"От навіщо починати казати те, що ти не збраєшся завершувати?!",,,,,,
"Не знаю, як інші, але я не ображаюсь, а злюся Жартувати з себе маю право тільки я",,,,,,
"та бо, молоко хоче гречку, а гречка не дає.",,,,,,
І всі на один час(,,,,,,
"А щоб тобi,ану іді сюда, думал ко мнє лесть,",,,,,,
"Все пішло у тартарари, як тільки мені здалося, що все добре.",,,,,,
"– Нєа, кінець року, люди!",,,,,,
"Нє, мав людям ногами гривку поправляти.",,,,,,
"не гуляща, а комунікабельна, але в цьому випадку, так, ТАСЯ гуляща.",,,,,,
"'Сам чувак із Харкова, цього року з''їздив до Києва на канікули, розказує мені, який класний Київ.'",,,,,,
"Тим і погані шлюби: якщо один з подружжя купує шось на власні кошти, другий рахує це повноправно своїм.",,,,,,
сиджу і думаю: непогано ти так виглядала в 10 років......,,,,,,
"Пардон, що влажу, але  ти десь недалеко від мене, і мені це не дає спокою.",,,,,,
ви або ставайте в стороні  або не лізьте серед дороги/проходу зі швидкістю підбитого равлика,,,,,,
"всім іззя, а їй можна, бо вона нємношк і це німецький фонд? серйозно?",,,,,,
"То мені психічна травма, блін і згадати не хочу",,,,,,
Я не говорила про іншу стать.,,,,,,
"І краде, і краде собі.",,,,,,
"Краще синиця в руках, ніж ти.",,,,,,
"Хочеться випити, читати нісенітниці і писати нісенітниці.",,,,,,
"Починай вчити, атвічаю, там ще багато чудових слів",,,,,,
"Та коли я вже висплюся, без прокидань о 3й ночі та без ворочання по дві години",,,,,,
Мозок: Я не дам тобі спати всю нiч!!,,,,,,
"'Якщо трохи пошкрябати тих, хто підриває людей у ​​Європі, обов''язково з''явиться російська сутність.'",,,,,,
"А тепер випускники обступили мій падік і передають колом сігу миру, позаду йде вчителька, їй уже на все пофіг",,,,,,
"ну значить буду мити ввечері, коли повернуся, не можу ж повністю проігнорувати",,,,,,
"Мені здається, я рухаюсь не в тому напрямку і, здається, мені навіть норм.",,,,,,
О так спасіба щедрим богам за маршутку,,,,,,
#ДОВЕЛИ МОГИЛЯНКУ RT : Ми поднімєм Магілянку с калєн!,,,,,,
'там уся м''якотка в коментах під цим висловлюванням бгг. з експертом здійснили статевий акт& опломбували (анально).',,,,,,
Хто рано встає - той більше нісенітниці встигає натвітити.,,,,,,
"Тепер неясно, чи то малолітня, яка в 14 родила, чи просто турботлива сестра.",,,,,,
"як мені це набридло, відчепись від мене з цим!",,,,,,
і хтось це я бо я не краду чуже,,,,,,
Поїду в в Острог і не вертаюсь.,,,,,,
"Спочатку ти обіцяєш їй забити цвях, а потім забиаєш інше.",,,,,,
А ідіть мимо канєшно,,,,,,
Сиджу ржу з фотки волохатого пінгвіна.,,,,,,
"Про всяк випадок вивчи фразу ""куди преш?"" кількома мовами.",,,,,,
"це ж релігієзнавство, ти ще до політології десятки джерел читай",,,,,,
"Він так вірував, він же був прихильником Савонароли",,,,,,
"Я ще вічно могла б нити, але нi",,,,,,
кляті дощі в Конотопі сплав переноситься на вихідні -_-,,,,,,
"Ідіть геть, не затягнете мене в свою цукрову секту.",,,,,,
"не нада, отож бо й воно)",,,,,,
"бухати, займатися сексом, читати Кафку і Кортасара, танцювати на столах, аж доки не помрете ;)",,,,,,
- ми про щось забулипро дитину #НічІзКевіном,,,,,,
Бо поки доберешся з одного краю Києва в інший то півдня пройде,,,,,,
Ну я божевільнийНо не на стільки,,,,,,
ну шо за питання взагалі,,,,,,
Ну я таки  пішов І тобі раджу,,,,,,
"кожна людина має право писати марення, це записано в конституції",,,,,,
Домашня обстановочька так і спонукає забити  на все,,,,,,
"Гасло всіх лікарень України :""Велкам"".",,,,,,
"самі ж грають на руку таким ситуаціям, а потім розказують про вагітних і знедолених, господи, це жах :(",,,,,,
Розфоловила глину ще до твітів румбамбара. Так не хочеться розфоловлювать малину,,,,,,
"Неа, ти слішкам класний шоб ображати треба",,,,,,
"в мене на минулому тижні було замовлення, одразу послав.",,,,,,
Хочеться взяти і повіситись,,,,,,
"І всі, вважають, шо їх проблеми найважливіші",,,,,,
"о боже, як я ненавиджу таке",,,,,,
"я маю враження, що він непогана людина, яка несе багато нісенітниці.",,,,,,
'Мої тоже мене б''ють не зле',,,,,,
"бгг ну що, вiдчув?  як зайшла ""творчість""?",,,,,,
"тре було послухати, чому моя доповідь погана",,,,,,
можеш мене послати якщо хочеш,,,,,,
"----Пацани, так а кто за кого вболіває?- в смислі? Ми футбол дивимось без тебе, шо за вапроси",,,,,,
"Можно купувати квитки, але...",,,,,,
"Ошуканцю ""прозоро"" натякають: - ця з/п виглядає як повна нісенітниця! є що сказати?",,,,,,
"Щоб у мене все було добре, тре лиш секс і щоб вони зникли.",,,,,,
"І що, це більшість жінок почувається -отак",,,,,,
"Та мене оце сюсі-пусі саму бісить, особливо, якщо то прямо, ПОСЕРЕДИНІ ПРОСПЕКТУ ВОЛІ",,,,,,
оці ваші тонкі ранімі душі. а як я почну на всьо ображатись?,,,,,,
Дурне то геть не нікчемний,,,,,,
- я вас по одному виловлю! - я не погрожую! - ви не маєте права мене тримати,,,,,,
"'Пріключєнія Діминої п''ятої точки продовжується, бл'",,,,,,
'RT : Тре'' бути няшкою.',,,,,,
"А можна я ще раз скажу, що ти поганий, і мені за це нічого не буде",,,,,,
"Йду відпочину, куплю собі вкуснях і буду байдикувати",,,,,,
уїду від вас у королівство Пропан-Бутан,,,,,,
"Якщо ти ще не займався анонiзмом, я йду до тебе.",,,,,,
з Киівом так само,,,,,,
"Чому відмазують шахраїв, що не можуть пояснити звідки гроші?",,,,,,
I як цей Порошенко тільки встигає?,,,,,,
"Бєсіт коли сплять всі, ти ходиш тихенько, щоб нікого не розбудити; коли спиш ти, всім все рiвно, робимо усе максимум гучно.",,,,,,
Чому в мене повна стрічка росіян?!,,,,,,
"Ну тут хто знаєчестнояк коли, все залежить від історії цього",,,,,,
"Хочу менше матюкатись, але як тут  не матюкатись, коли робиться такий жах???",,,,,,
"Та я теж, але  і так весь час дома, а там щось цікаве.",,,,,,
"Мені здається, що на мене пожалілись моєму стоматологу, що я говорю багато.",,,,,,
Краще буду балакати про них за спиною,,,,,,
"'Ой дівчата і хлоп''ята, це погано .'",,,,,,
Бистрі ноги покарання не знають:),,,,,,
"Отак спілкуєшся з хорошою людиною, все йде добре, і раптом як як скажеш якусь нісенітницю...",,,,,,
"Люди не як кораблi, люди як божевiльнi",,,,,,
"Вирядилася, на зйомки патріотичного вiдио.",,,,,,
"Поки Порошенко незрозуміло шо робить, Юрій Луценко повертає в країну гроші Януковича, відновлює контроль держави за...",,,,,,
"Можеш мене вважати диваком, але падкат робиться в незалежності від наявності дівчини. :)",,,,,,
"По Сємьйончєнко, чи Жиртрєстокабанчєнко, я вже не знаю, коротко: знімати недоторканість і закривати.",,,,,,
Одне питання: і що зроблено/планується зробити за останній час?,,,,,,
"Поганий велосипед, який не їде при чому",,,,,,
"ско, коли ти нормально коми ставити будеш. на твої твіти дивитись соромно.",,,,,,
"Всі це роблять, а хто говорить що не робить, робить це подвійно",,,,,,
"Яка різниця, котра година: аби творити щопопало, час не важливий",,,,,,
Бубічьок головне не накручуй себе;) а я тебе люблю,,,,,,
Чувакам в ІТ треба робити обличчя попроще.,,,,,,
ну блiн забув про мене,,,,,,
Як же жаль тих хлопців що склали голови.,,,,,,
обізвав мене вже 5-й раз.,,,,,,
"Не поїдете - обговорять, скажуть злякався.",,,,,,
який же там капець,,,,,,
Щоб я ше раз так їхав на фест.,,,,,,
"RT : Не дарма Бог забрав стать у ангелів, шоб не мали всіх навколо.",,,,,,
"Чуваки, я вирубилася,зараз прокинулася і мені до страшно.Здається,що зараз щось завітає.І Сані не можна подзвонити(",,,,,,
"Не думала, що боляче намагатись бути поряд коли людині все одно,або ж кохати її",,,,,,
"На майдані Руслана несе несемітницю, точно таку як в старі добрі часи",,,,,,
'Чого мене не зіб''є трамвай.',,,,,,
"Ти не повіриш, але да!",,,,,,
А навіщо переживати і нервуватись тож нікому взагалі не треба.,,,,,,
"Кстатє, цього року я була настільки поганою дівчинкою, що Миколай не приніс мені навіть різочок.",,,,,,
От і я нічо А шо шо,,,,,,
"котики, якщо людині все одно, то все одно.і не старайтесь.",,,,,,
"Донна, ну..., ну...!!!",,,,,,
"Це ж руки, навчися ними користуватися!",,,,,,
Україна таки трошк крутить педалі (доки нє накідалі гг) але до цивілізованого світу ще iти i iти,,,,,,
2000-й пост був про мою нестрашну морду,,,,,,
Вона таки наговорила на бан.,,,,,,
"Я з тих, хто чекає дедлайна, а потім надриваюсь, щоб усе встигнути.",,,,,,
"Не поважаю тих, хто думав що комусь цікаво, що там лайкають інші.",,,,,,
Бо це ж гра ведеться.,,,,,,
"капець ""Ghostbusters: Female stars confirmed""",,,,,,
"Мама питає як твоє самопочуття, а в тебе чоловічий статевий орган на екрані відкритий.",,,,,,
"Я просто такая маленькая и злобная, яка прагне привласнювати собі людей і тримати їх на повідку біля себе.",,,,,,
"Вони займаються анальним сексом, їм нема часу писати першим",,,,,,
"Атлічнєнько попрацювала Безуглик на інтері,Кісєльов дав атвєточку за те,що в нього забрали програму,в шустер  ще та",,,,,,
"Понаблюдала деньок за сімейним життям (сестра, її чоловік і двоє дітей) і поняла, шо нi, нi",,,,,,
"Я увесь вечір знущався з накшталту : дали субсидію? малаццьі. Не важливо це, главноє, щто Порох в офшори вьівєл тобі тьіщщі доляров.",,,,,,
"Луччє я був ноунеймом, чем праслявлюсь і мене стануть показувати по тв",,,,,,
"Як людина, в якої від спеки пвь скоро повне крапати з очей, прошу грози, просто дощу з блискавками",,,,,,
"'відчуваю себе дивно, бо знаю цю пісню напам''ять'",,,,,,
"колись розкажу, але не тут, а то злетяться всякі збоченці, які почнуть дурість писати)",,,,,,
"Давно на землю спустився демон, який захотів змучити людство та придумав він переїзди.",,,,,,
"(Ну або які в нас там ще є елітарні хлопці, яким власна елітарність без хлопці донецьких недостатньо елітарна)",,,,,,
"Щороку,  чим ближче до дня народження, тим більше хочеться до нього не дожити.",,,,,,
"Моя улюблена ""помаранчева"" пісня - це ""Зимова спека""  #піснісвободи",,,,,,
тільки він ще і понага людина.,,,,,,
"Якщо я когось не читаю, значить я не хочу їх бачити в стрічці.",,,,,,
"'Лєвий мужик в телеграмі написав мені, що він здав аналізи, і що ""все добре, можна займатися любов''ю'",,,,,,
Какова чорта нічо што я тут,,,,,,
Ранок і час мені вставати:3,,,,,,
'вночі тебе б''ють монстри з-під ліжка.',,,,,,
"Давайте організовуйтесь, тягніть того мого коханого за вуха і їдьте до мене",,,,,,
ти мої думки читаєш :),,,,,,
"А що зробив ти, придбав квартиру?",,,,,,
"Не лайкають-погано, лайкають-теж погано. Зроби вибір, жінко",,,,,,
"Як би так смішно шуткануть, щоб усі зрозуміли як мені погано цього поганого ранку",,,,,,
Перегар ЖЕКівців аж через трубку чути,,,,,,
А якщо  целюліт?,,,,,,
"Хоча, спати з мужиками якось взагалі ніочєнь",,,,,,
"Такк ты поводишся так же як ті дівки, що зайшли до кімнати джанк",,,,,,
"Накуплю собі кактусів і рому, а ви ідіть вже.",,,,,,
"Якби я палила, я б зара накурилась вусмерть.",,,,,,
"Люди, які мріють жити самі, ви нормальни?",,,,,,
це не в дурнощі справа,,,,,,
Просто приходив і все одно на що Ніколи не знав того розкладу,,,,,,
"Лягаєм, деремось з малою за одіяло",,,,,,
Я за кермом: будеш їхати чи повзти?!!,,,,,,
Знову купила нові- а вони теж ніякі,,,,,,
Зараз згадую та відчуваю неабиякий сором: співаю-то я погано.,,,,,,
"Хай син Порошенка відповідає :* Ну чи той людина, на кого за кордоном зареєстровано.",,,,,,
"Слухайте музику в навушниках, А НЕ ЧЕРЕЗ ДИНАМІК",,,,,,
"Навіть якщо ти, навіть краєм ні до того, ні до того.",,,,,,
"Але підтверджувати, що ти ""погана людина"", я не буду",,,,,,
"#Добриранок всім хто зара в церкві слухає батюшку як він проклинає фарисеїв, седукеїв і римлян!",,,,,,
Йдіть знаєте куди зі своїм холодом,,,,,,
Поцілував за сідниці Кім Кардашьян,,,,,,
"'#цитати великих людей:""Рокитне це тобі не аби що""#автостоп #України''а'",,,,,,
"так, спочатку Коля, тепер ти це передається недоповітряно-недокрапельно-твіттерським шляхом?",,,,,,
ROCKY ROAD TO DUBLIN,,,,,,
"він зрозумів, що з Україною в нього ніц не вийшло і запостив меседж про колір плаття",,,,,,
"Як казав Сет, ай ладн",,,,,,
Й кава у них таки погана якась.,,,,,,
"Напад на конвой СБУ, що тут такого?",,,,,,
2) викинути і налити вінішка.,,,,,,
"'Підпалювати сусіду п''ятки, поки вiн спить в обнімку з телефоном - приголомшливо'",,,,,,
НАВУШНИКИ. я загубила навушники. Як можна було загубити навушники?!,,,,,,
ну всякі люди інші могли подобатися,,,,,,
Хоча я сам через раз не розумію владу і не підтримую,,,,,,
"Хз, моя скаче між ""я нерозумна погана людина"" і просто ""погана людина"".",,,,,,
вуахаха іба нічого мене кусати!,,,,,,
"А чому ти працювала, я тебе вже два місяці не вмикав.",,,,,,
"Коли німці говорять німецькою, їх хочеться повалити й кохатися, коли я говорю німецькою, мене хочеться прибити табуреткою.",,,,,,
"Вона настільки класна, що якби вона була мужиком, я б любила його цілодобово!",,,,,,
"fork - це вілка, а ножик - поняття не маю ©Алєжик",,,,,,
Хахахах УжґдалітьІ я ото ще виправляв ото слово,,,,,,
"Той хто казав що після відносин і любові немає дружби, брехав.",,,,,,
Дурне навчанняЯ вже почала тихо ненавидіти 11 клас -_-,,,,,,
"'""Легковажність, блуд і разврат"" '' Вованада про виставу Декамерон в ляльковому театрі'",,,,,,
"Луччє ты б навчився йти далеко так, як це зробив тектонік",,,,,,
нє ну в туалет то він полюбому ж хоче,,,,,,
"Ця спека думає, шо змусить мене вдіти майку з шортами, але ні вже.",,,,,,
Це якесь знущання від розробників,,,,,,
"Хто смішні картінки дівчині кидає, той її і використовує.",,,,,,
"порошок, не буду я за тобою бігати.",,,,,,
"нє, просто мене пре фраза - няняня-фігня) Та й який з мене отаку?",,,,,,
я нічого не встигну перекласти ці тексти за 2 дні.,,,,,,
Та дістали вже своїми піКардами.,,,,,,
"Я а хто його знає, одного мене вже прикачала та кроватка-бук у стрічці?",,,,,,
"Я приголомшлива, як казала Камі))",,,,,,
"яка різниця хто ти за дипломом,  якщо ти не хороша людина",,,,,,
"Та ну нє, це ж там підписувати бумажку треба, лінь.",,,,,,
мені в школі і не так казали,,,,,,
"Пора слухати величну симфонію *Ну його в баню*, а завершувати увертюрою *капець* до симфонії *Життя*",,,,,,
звідки вони вобше вилізли?,,,,,,
"Знайому запросили гуляти двоє пацанів.Один - крутий чувак, з афігєнним почуттям гумору, інший - егоїст.",,,,,,
"Де гарантія, шо цей людина  не натворить дурість і після смерті?",,,,,,
А ти не бачиш скільки разів?!,,,,,,
