"А варто лиш почути всяку наркоманську фігню, ржу як коняка.",,,,,,
Ну вас з вашою політикою.,,,,,,
"'П''яний друг каже: "" ніколи займайся сексом с дівчатами з економічного...""'",,,,,,
"привіт пенсіонерський відпочинок: сходила в замок, погуляла набережною, випила, тепер наступні дві доби хочу просто проспати в номері.",,,,,,
"не звертай уваги. таких мільйон, ти одна.)",,,,,,
Через твіттер  капуста підгоріла ._.,,,,,,
"Я: Рєбзь, може суші візьмем?",,,,,,
"Ну, давайте вже про імпотенцію та рак, так нецікаво.",,,,,,
Я викину цю картку в Стікс,,,,,,
я тікаю від вас спати,,,,,,
а шо це справді лякає?) я завжди так роблю,,,,,,
Ахахах уявив собі це,,,,,,
"Ого, а навіщо вони це постять",,,,,,
"А навіщо він, є від нього щось, окрім шкоди?",,,,,,
"Я sooooo excited, прям заднім місцем в кріслі пританцьовую",,,,,,
"словом, набридло то всьо. ви кто такіє? я вас не звал. iдіть звідси",,,,,,
Один раз побув поганим чоловіком і на все життя ним залишився.,,,,,,
Однаково погано добиратись з Наукової до Рясне шо старим 131 шо новим 11 #lviv,,,,,,
Де вона зараз – ніхто не знає,,,,,,
"Жарт, над яким не гріх поплакати.",,,,,,
"ой блін, плюнув подорожник приклав і кайф",,,,,,
Ну  чого вони такі каєфні?,,,,,,
"я за сьогодні вже 2 рази , руки реально нiзвiдки треба ростуть",,,,,,
"Можу допомогти, все рівно нічим не займаюсь",,,,,,
"росіян У росіян знов ""лєнере"" загострення.",,,,,,
"'п''ята точка, к слову – на 2 з мінусом і без наколок.'",,,,,,
Я буда в шоцi і привела кураторку.,,,,,,
"До деяких людей не виникає інших питань, окрім ""Ти уже родився таким?"".",,,,,,
Я можу придумувати дивні програми для СТБ.,,,,,,
"ті самі, котрі ""полная імпотєнція в укаінском інфополє"" і через два твіти – ""боти Порошенко на з/п"" гг",,,,,,
Хахахах зато ви всі такі правильні що Господь Бог цурається  вас,,,,,,
Вангую прапори новоросій чи іншого роду провокативні речі на трибунах,,,,,,
"Сміх сміхом, а попа горіхом",,,,,,
"Тільки раптом що це їсти треба, а не намазувати кудись",,,,,,
"-ЦЕ ТИ МЕНЕ ЩА ТОВСТИМ ОБІЗВАЛА, ТА?!",,,,,,
"Ранок почався з мамчиних нарікань на укргазбанк-поганий укргаз, негарні- и тебе хорошего дня",,,,,,
"несчатье тим людям, які розвивали рейшинал чойс теорію, ВОІСТІНУ.",,,,,,
"Хтіли ""паставіть падножку Порошєнка"", а вийшло наоборот тільки.",,,,,,
Мій ентузіазм підриває погане самопочуття,,,,,,
"Нічого осбливого, просто новий пляж в Тернополі*НЕЙМОВIРНО*",,,,,,
"Навіщо хлопу дівчина яка вміє рахувати дискримінант, та ще й вишивати, що він з нею буде робити?",,,,,,
"навіщо я сюди ходив – науці не відомо. замкнутий круг, нєбо вокруг.",,,,,,
"почуте днями біля екс-тудора: ""бог триєдиний""",,,,,,
У французьких блогерів відчувається напруга.,,,,,,
"Ви звертали увагу, на скільки багато повилазило циніків?",,,,,,
От вам моя експертна думка:ніфіга англійці не розуміють в революціях.,,,,,,
"Ти шо куриш, а я досі про то не знала",,,,,,
Я знаю дякую ще чоловіка забула...ну і послати мене далеко,,,,,,
#Неважливо #якою # мовою # головне # шоб #купа #хештегів #беззмістовних # було,,,,,,
"Ці поганi люди, які постять оголошення про кімнати, а потім не відписують",,,,,,
"Хочеться насильно змушувати кохаися усіх, хто ниє.",,,,,,
"Спитав пан Богдан, які ми знаємо три євоейські свята, і я сказав РАМАДАН",,,,,,
"блін, хотіла від когось відписацця, погортала подивилась, а всі такі коти ідіть звідси",,,,,,
"Якийсь трошки  проблеми з цим розслідуванням голаднців, ні?",,,,,,
"'Шо за фігня Вже тиждень ниють м''язи в ногах (верх литки), і я ледве стою на ногах'",,,,,,
"Підходить промоутер на Волині, парить фiгню, відповідь жіночки:- Сонечко немаю часу тебе послухати, там дитя мене жде",,,,,,
"І рибку, і на ще дещо, та?",,,,,,
"І там тебе знайду, в мене віза на всі страни",,,,,,
"набити орган, щоб хоч десь він у мене був",,,,,,
"'Тому взяла і посмажила м''ясо собі,можна в пиві перед тим вимочити,але не саме пиво пити..............'",,,,,,
Треба просто напросто не зв’язуватись з ними,,,,,,
"Боже як скучно, нормальна людина вже пішла б спать, но нет, віка ж спала півдня і тепер не засне",,,,,,
Перестаньте бути такими хоч на день,,,,,,
"ох, львівські ранкові затори.не люблю, не скучила, идите в баню",,,,,,
"Відстань, це обідно :(",,,,,,
Шей мамі  300грн віддав.,,,,,,
Всім все одно на вашу думку.,,,,,,
І тут доїхало бгг.,,,,,,
"Сидиш собі, і раптом як починає всяке марення думатися.",,,,,,
Як сенс життя,,,,,,
"зважаючи на мою погану поведінку - ті хто не поїхали і можуть товаришувати - вони пройшли ценз, бггг",,,,,,
"Так от, може за #ЛяВорк я і скучила, але ніяк не за ранковими підйомами.",,,,,,
"З ""українськими"" змі боротись з утисками слабоди слова і давати  за рублі",,,,,,
На скільки справ ще не забито!,,,,,,
то я богато того вчивщо вже не знав що вчити но треба було,,,,,,
"Що це твоя хата, а отже ти можеш хоч і бомжа привести.",,,,,,
йдіть в вк ті дєла обговорювати,,,,,,
а я от думаю для кого яськів постила картінку,,,,,,
Я вже 2 тижні не можу провести необхідні мені операції,,,,,,
"Мої одногрупники, що сидять попереду мене, жруть мандарини, зефір та сир.",,,,,,
"Дивлячись на те, як воно з іскрою в очах спорожнилося в пюре, поганий із нього Рататуй",,,,,,
але ж він  не переплутав дні!,,,,,,
"Якщо ми будем так цілий рік салати по трохи їсти, то йди ти далеко",,,,,,
як же мене всі бісять,,,,,,
"Взяла сир-косичку, крабові палички, зробила Кривавої Мері та послала усе, що тільки можна.",,,,,,
мама: тобі б не мішало похудать і зайнятися коханням: мааам,,,,,,
"Отже, те, що одним під силу, іншим все одно.",,,,,,
"Анатомка, я тебе обожнюю.",,,,,,
"Якби за кожну твою брехню я дарувала тобі по одній повітряній кульці, ти б давно полетів #думки_вголос",,,,,,
"- іду ""на ви"".  - іди геть!",,,,,,
'я дуже здивована і як тепер видалити пам''ять',,,,,,
"Пилипишин-здивувався, всі здивувалися",,,,,,
"Хвала небесам, що менi все одно на укладку",,,,,,
#ЯкщоДніпроВиграє я перестану робити маячьню...,,,,,,
Займатися коханням- це як рання весна,,,,,,
"Я хочу вивчити ще багато мов, але ж..",,,,,,
"Так шо, то ваші проблеми",,,,,,
Аа там пеперва під час пари погана.,,,,,,
"'Викликайте екзорциста, я з розуму з''їхав.'",,,,,,
"Мам, мені поганоі ржу.",,,,,,
Мо спраглих за Вітєю тра просто налупити до  сцяк?,,,,,,
"Або викладач умник мене одногрупник достал, зошит за лекцію закінчився скоро сесія, за шооооо????",,,,,,
"Поки я спала та купалася в морі, ви базікали про айфон.",,,,,,
"Там у слові була не та літера, і ніхто не здогадався, що це просто опечатка.",,,,,,
"'якось стрьомно, коли п''яна людина спершу вимагає пустити його в під''їзд, а тоді називає тебе поганим словом та погрожує'",,,,,,
"Моя мама без всякої задньої думки каже дитині, коли вона по вулиці гасає: ""Обережно, не вдарся десь!""",,,,,,
"Тому погане залишається в КП, а я вирушаю в дорогу.",,,,,,
"Холодно стало, дєвок нє сталоПтічкі вапно перєсталі клєватьНе комфортно курити на балконі",,,,,,
"Набридли  гуманітарії,набридли технарі, усі набридли , ідіть звідси.",,,,,,
аххххах :D даішники :D,,,,,,
"Пацани що таксують в Über, не намагайтесь обдурити",,,,,,
"Тобто професори тримаються бодрячком, але всі розуміють, що це кінець?",,,,,,
'Або завжди можна воз''єднатися з самотньою жінкою за 40',,,,,,
"Нє, я в кєдах поїду.",,,,,,
тіки не кажи що та ж фигня?)),,,,,,
Собаки з усього району почали вити.,,,,,,
"А йде лише, той, який у дорозі добу, цілу добу",,,,,,
"'не пам''ятаю де в мене пара, а в розкладі неправильний кабінет'",,,,,,
І живи тепер з цим,,,,,,
"Ну то що, жінко, там і тридцятник недалеко.",,,,,,
"'Дуже часто це навіть необхідно, бо таких терпіти зась, а вони ж знають, що ти наче зобов''язана'",,,,,,
"Кидає мені, а я ж невміха.",,,,,,
"Тому що, там починаєш вводити назву, а воно не знаходить.",,,,,,
Як тільки зайшов почали стукати і кричать мол  чому так довго говориш,,,,,,
"Загалом агітація набридла вже - папірці сують,листи надсилають,додому телефонують(!).",,,,,,
я б так взула *___*,,,,,,
"я вражений. не знаю, чи зможу я з цим далі жити, ага.",,,,,,
"'Коли деякі люди знову говорять, як добре жилося при сср, то нагадуєш їм, що 3джі з мемасиками, з''явилися саме при укровласті! Замовкают'",,,,,,
"'Якщо бажання нагодувати передує бажанню займатися любов''ю - це всьо, пиши пропало.'",,,,,,
"Бандеролька в Америку йде майже два місяці, блін",,,,,,
"так, де вічний двигун",,,,,,
"Кажіть, що я можу більше, ніж те, що я зараз роблю.",,,,,,
"А вобше мені потрібна людина, котра битиме мене щоразу по кривих руках, примовляючи: «Бачиш?",,,,,,
"Навіщо засмічувати тві своїми поганими фотками, в той час коли ти вважаєш себе негарним?",,,,,,
"Не зря, ой не зря зробив шенген на 5 років",,,,,,
"всю велику родину дають в нарузку, всю ненавість",,,,,,
Може кинути все і вступити на театральний?,,,,,,
"все нісенітниця, вже втретє чую)",,,,,,
"Але обережно - захопившись, можна послати в баню взагалі всіх, і лишитись соціально непристосованим і самотнім.",,,,,,
Та ну їх =),,,,,,
мене і так ніхто не хоче,,,,,,
"Типовий твіт українського початківця цієї соціалки: вакарчук, укрправда, мустафа, Тимчук, аваков, сальцова і кілька поганих міст.",,,,,,
"Ната ""Або просто бесіда з Натою і Владом.",,,,,,
Рєбята сорі за то шо я погана,,,,,,
та бо рілу багато всьогго,,,,,,
"ну шо, без розчарувань взагалі ніяк?",,,,,,
"З трудом, но я вже це зробила, тепер мені все рівно і це прекрасно",,,,,,
"Молюсь, шоб та штука в мому рюкзаку не розлилася.",,,,,,
опять дежавю вже третє за два дні,,,,,,
вже весь твіттер знає шо ми живем як буржуї,,,,,,
"Є така нісенітниця, яку важко пояснити",,,,,,
"'Рев''ю з ейчаром і тімлідом перетворилося на шквал компліментів і теплих слів, від яких я розчервонілася .'",,,,,,
Ну тепер треба терміново поїсти сиру.,,,,,,
'який умник засунув пакетик фруктового чая до м''ятного?',,,,,,
які ж всі погани,,,,,,
"*збирається у важливу путь*- ти повинен сказати щось, що надихне. - просто іди.",,,,,,
'Чай з м''ятою і медом трошки кориці додай і спати',,,,,,
"таваріщі, ну який порошенко.",,,,,,
"тьфу блін, отак одним махом все перепортити. ну зачєм?",,,,,,
"Я тебе кохала день у день,А ти як себе ведеш",,,,,,
ну вот...індустрія гумових баб досягла досконалості!,,,,,,
І от хотілось би скоріше прокинутися.,,,,,,
Він в ексклюзиві для блумберг стільки наговорив.,,,,,,
"байдуже на всіх, але Севілья забила.",,,,,,
"я от зробила тотуху літачка, а тепер думаю ""ну і навiщо?""",,,,,,
"експертний висновок роботи Фоменка від : ""Міг би тоді і Бойка випустити. "" #UKRPOL",,,,,,
"#hipster_love RT : у мене бажання з кимось переспати , але інет тупить(((",,,,,,
"Знай, коли я тебе побачу, тобі кінець.",,,,,,
"Та нє, вона пошле",,,,,,
зранку краще заходить,,,,,,
Ей ю сі кей.,,,,,,
'Я ше під під''їздом сиджу і всіх розпусними називаю',,,,,,
"- "" ... гуцул іншу любить скрито*ґ""- поганий чоловік!",,,,,,
"попа ти, катя, - сказала мама і пішла робити мені каву)",,,,,,
"будьте обережні з поганими бажаннями, вони мають срану властивість збуватися",,,,,,
Але на справді Богуслав безсердечна людина,,,,,,
"йди спати, бо подзвоню в 5 і чому ти ващж не виспишся",,,,,,
послам все одно на Україну,,,,,,
Хочу дви роботи та жодной хвилини думати про непотриб.,,,,,,
"Ні, не розумієте(Відсилка до неякісної реклами)",,,,,,
Любіть Україну!,,,,,,
"Замовила, відправили....ну чого ж в найкращих забирають життя...",,,,,,
"Зара ще ягодицiобмотаю, красиво, здурiти!",,,,,,
"Та всеодно, вони знають, що є",,,,,,
Шо там учити - бери та роби,,,,,,
ви такі кумедні.,,,,,,
"Гірше за все прикидатися, шо тобі байдуже.",,,,,,
знімай стрес правильно -иди в магазин!,,,,,,
"та будь ласка, те що я поганий то не секрет:)",,,,,,
Потягів без кричущих дітей не існує.,,,,,,
предмет не важливий,,,,,,
Згадав свій сон і це кiнець.,,,,,,
Вдягала ліфчик - відірвала бретельку разом зі шматком чашки.,,,,,,
"Я знаю, що ти це читаеш, Т. Я його НЕ  ПIКАПЛЮ. -.",,,,,,
Просто бінго-****40-річний співробітник відділу оперативного супроводження адміністрування ПДВ...,,,,,,
"По перше, більшість стоків і секондів перебільшують з цінами",,,,,,
Вмій визнавати свої помилки і вчитися.,,,,,,
"Ну що, чувствую себе як дитина яка накосячила і її приперли до стєнкі",,,,,,
"мала бути*та блін, я замахалась вже виправляти помилки, кіл мі",,,,,,
"Може коли ти стоїш біля людини, вона хоче тебе вдарити, а стоматолог тебе захищаєПОДУМОЙ",,,,,,
"не варто стріматись,якщо не поводити себе  неправильно, то все ок буде.",,,,,,
"знатно я впав, якраз перед канцом Еполетс всі ноги болять, БЛІН!",,,,,,
"Я дуже рада, що вам подобається моя попа, але чи не могли б ви, будь ласка, лайкати і мою душу???",,,,,,
"ота завжди з вами, не поймеш що в голові",,,,,,
Єдиний спосіб мати відстань між ляхами - цілодобово займатися коханням.,,,,,,
навіть коли несеш несенитницю,,,,,,
До твого списку все не зрозумій хто,,,,,,
Кусок живота з-під задертого светра - ух секс!,,,,,,
"Мені тут під зауваженням у щоденнику написали ""здохни"", а потім ще й почула, що я ""зовсiм того"".",,,,,,
"Уся сіль у тому, що в цього чоловіка МЕДИЧНА, ОСВІТА",,,,,,
Бо це теж та ще помийка,,,,,,
"Боженька оточує тебе поганцями, щоб перевірити наскільки ти готовий до пекла.",,,,,,
"Доки не пізно, сповідайся, якшо спав з кимось із фоловерів.",,,,,,
"Понароблюють фігні, котра рветься після першого ж разу.",,,,,,
"Вкладники Привата напилися настоянки глоду, і потім російських послів стріляють.",,,,,,
Дайте мені машину часу і йдіть геть,,,,,,
"'Боже, чому просто не можна зобов''язати вчити англійську всіх людей, які так чи інакше контактують з іноземцями.'",,,,,,
"'капелюх обов''язково треба надіти, всё равно  шо зима і вуха мерзнуть, капелюх і окуляри, без окуляр читати взагалі нема сенсу'",,,,,,
"Цікаво,а якщо він підірве щось в Лондоні,Брюселі,Парижі,Берліні і т.д.",,,,,,
"Перший снігопад сезону, за півтори доби до його завершення#миздобули",,,,,,
В яких ти зараз йдеш далеко,,,,,,
"тікі виставлю історію вк,  сразу її дивляться деякі люди, нагадуючи про себе,  а мені потім страдай",,,,,,
"А ти потім ходи і думай, шо за дурниця відюувається навколо",,,,,,
НитиА не бути дурною жінкою,,,,,,
вже третій день поспіль про члени/груди/секс і т.п. говорю.,,,,,,
пройшов вже через цю ситуацію просто,,,,,,
"Не висипалась уже не знаю скільки, і ніяк не можу.",,,,,,
Зараз би за віндоус докопатися.,,,,,,
"Підвозиш людину, а вона починає безглузді поради під руку роздавати.",,,,,,
"олсо, фан факт: до 85 в Уругваї була діктатура і діка інфляція.",,,,,,
"та халепа))) я не очікувала, що прям так одразу це навчання почнеться з першого повідомлення))",,,,,,
"Боже, наші люди всьо фільтрують божими законами",,,,,,
"'от все вказує на те, що треба пити, і чому я ще досі не п''ю??????'",,,,,,
"Я нікого не тримаю, уходиш то й йди",,,,,,
"Я не хочу, щоб він закінчувався :(",,,,,,
Я бачила гоблінський переклад цього,,,,,,
Його б я розділа і віддалася б йому,,,,,,
"Нашо, можна ж тебе вдарить",,,,,,
"Зрозуміла, що коли немає особистого життя нізя сідати біля гарних хлопців.",,,,,,
"Навіть коли такий жах, як зараз :(",,,,,,
"які плювали на всіх, від гаїшника до прокурора.",,,,,,
"Та ну , я сьогодні навіть вдягнена пристойно, шо знову не так?",,,,,,
Довелося 15 хвилин чекати ту жінку.,,,,,,
"Скільки  не корми, все одно йде якнайдалі",,,,,,
"Та звідки рендомному чуваку або чувісі з інтернетів знати, чим я займаюсь?",,,,,,
Дике бажання взагалi забрати документи.,,,,,,
"Не хочу я ваш Новий рік, то не свято, а фiгня якась",,,,,,
В тебе забув спитати,,,,,,
ща на одних дівок наброшу,,,,,,
"Тіко альтернативно обдарований чекає ""націоналізації"" що зачепить сусіда і не зачепить його",,,,,,
"І ПОШУКОВІ ЗАПИТИ, там повний треш)",,,,,,
