Sentence,Toxicity Level,Tone,Language,Implied Sentiment,Keyword Vector,K_means_cluster
"hey , idiot , i said ill be more careful not to remove content .",Medium,Disrespectful,Insulting and condescending,Frustration,"(1, 0, 0, 0, 0, 0, 0, 0, 0, 0, 0, 0, 0, 1, 0, 1, 0, 0, 0, 0, 0, 0, 0, 0, 0, 0, 0, 0, 0, 0, 0, 0, 0, 0, 0, 0, 0)",0
let darwinism take its course so that the least stupid shall inherit the earth .,Medium,Casual,Sarcastic,Cynical,"(0, 0, 0, 0, 0, 0, 0, 0, 0, 1, 0, 0, 0, 0, 0, 0, 0, 0, 0, 0, 0, 0, 0, 0, 0, 0, 0, 0, 1, 0, 0, 0, 0, 0, 0, 0, 0)",0
"* well shit , cunt shot himself .",High,Vulgar,Explicit and Aggressive,Negative,"(0, 0, 0, 1, 0, 0, 0, 0, 0, 0, 0, 0, 1, 0, 0, 0, 0, 0, 0, 0, 0, 0, 0, 0, 0, 0, 0, 0, 0, 0, 0, 1, 0, 0, 0, 0, 0)",2
"holy shit , just finished the season and it is so good but so * dark * , especially at the end .",Low,Excited,Casual,Positive,"(0, 0, 0, 0, 0, 0, 0, 0, 0, 0, 0, 0, 0, 0, 0, 0, 0, 0, 0, 0, 0, 0, 0, 0, 0, 0, 0, 0, 1, 0, 0, 0, 0, 0, 0, 0, 1)",0
the really sad fucking part is they tried this story before in number maannews .,Medium,Negative,Vulgar,Frustration and Disappointment,"(0, 0, 0, 0, 0, 0, 0, 0, 0, 0, 0, 0, 1, 0, 0, 0, 0, 0, 0, 0, 0, 0, 0, 0, 0, 0, 0, 0, 0, 0, 0, 1, 0, 0, 0, 0, 0)",2
WARNING: THIS FAG SUPPORTS HITLER,High,Alerting,Derogatory and Offensive,Hateful,"(0, 0, 0, 0, 1, 0, 0, 0, 0, 0, 0, 0, 0, 0, 0, 0, 1, 0, 0, 0, 0, 0, 0, 0, 0, 0, 0, 0, 0, 0, 0, 0, 0, 0, 0, 0, 0)",0
"it s like fucking jurassic park , but much fluffier ! .",Medium,Excited/Enthusiastic,Swear words used,Positive,"(0, 0, 0, 0, 0, 0, 0, 0, 0, 0, 0, 0, 0, 0, 0, 0, 0, 0, 0, 0, 0, 0, 0, 0, 0, 0, 0, 0, 0, 0, 0, 0, 0, 0, 0, 0, 1)",0
dont give us that crap about out of towners coming here and dropping buckets either .,Medium,Aggressive,Sarcastic and dismissive,Disrespectful,"(0, 0, 0, 1, 0, 0, 0, 0, 0, 1, 1, 0, 0, 0, 0, 1, 0, 0, 0, 0, 0, 0, 0, 0, 0, 0, 0, 0, 0, 0, 0, 0, 0, 0, 0, 0, 0)",0
"seriously , at least number people are dead leave aside your point scoring and generally just fuck off .",High,Aggressive,Vulgar and Dismissive,Hostile,"(0, 1, 0, 1, 0, 0, 0, 0, 0, 0, 1, 0, 0, 0, 0, 0, 0, 0, 0, 0, 0, 0, 0, 0, 0, 0, 0, 0, 0, 0, 0, 1, 0, 0, 0, 0, 0)",2
can we just keep dog shit out of this ? .,Low,Dismissive,Casual,Annoyance,"(0, 0, 0, 0, 0, 0, 0, 0, 0, 0, 1, 0, 0, 0, 0, 0, 0, 0, 0, 0, 0, 0, 0, 0, 0, 0, 0, 0, 1, 0, 0, 0, 0, 0, 0, 0, 0)",0
come on ya fuckin dummy get your right step right .,High,Aggressive,Vulgar and Insulting,Hostile,"(1, 1, 0, 1, 0, 0, 0, 0, 0, 0, 0, 0, 0, 0, 0, 0, 0, 0, 0, 0, 0, 0, 0, 0, 0, 0, 0, 0, 0, 0, 0, 1, 0, 0, 0, 0, 0)",1
"if you continue being a jackass , you will be blocked from editing wikipedia .",Medium,Warning,Criticizing,Authoritative,"(0, 0, 0, 0, 0, 0, 0, 0, 0, 0, 0, 0, 0, 0, 0, 0, 0, 0, 0, 0, 0, 0, 0, 0, 0, 0, 0, 0, 0, 0, 0, 0, 0, 0, 0, 0, 0)",0
"collins , is an idiot , but we didnt need this article to establish that fact .",Medium,Disrespectful,Insulting and Contemptuous,Derisive,"(1, 0, 0, 0, 0, 0, 0, 0, 1, 0, 0, 0, 0, 0, 0, 1, 0, 1, 0, 0, 0, 0, 0, 0, 0, 0, 0, 0, 0, 0, 0, 0, 0, 0, 0, 0, 0)",0
"How could the capital of Israel not be part of Israel, you fucking brainwashed Arab dumbass.",High,Aggressive,Derogatory and Racist,Hateful,"(0, 0, 0, 1, 1, 0, 0, 0, 0, 0, 0, 0, 0, 0, 0, 0, 0, 0, 0, 0, 0, 0, 0, 0, 0, 0, 0, 0, 0, 0, 0, 0, 0, 0, 0, 0, 0)",0
"I'm not going to reply to your ignorants comments, it's a zero!",Medium,Defensive,Critical and Dismissive,Frustrated,"(0, 0, 0, 0, 0, 0, 1, 0, 0, 0, 1, 0, 0, 0, 0, 0, 0, 0, 0, 0, 0, 0, 0, 1, 0, 0, 0, 0, 0, 0, 0, 0, 0, 0, 0, 1, 0)",0
Nazi Sean Hoyland vandalized these pages.,High,Accusatory,Hateful and Offensive,Angry,"(0, 0, 0, 0, 0, 1, 0, 0, 0, 0, 0, 0, 0, 0, 0, 0, 1, 0, 0, 0, 0, 0, 0, 0, 0, 0, 0, 0, 0, 0, 0, 0, 0, 1, 0, 0, 0)",0
or just go with this cunt en .,High,Dismissive,Insulting,Hostile,"(1, 1, 0, 0, 0, 0, 0, 0, 0, 0, 1, 0, 0, 0, 0, 0, 0, 0, 0, 0, 0, 0, 0, 0, 0, 0, 0, 0, 0, 0, 0, 0, 0, 0, 0, 0, 0)",1
"just a thought , but maybe stay the fuck away from the chinese .",High,Defiant,Aggressive and Offensive,Discriminatory,"(0, 0, 0, 1, 0, 0, 0, 0, 0, 0, 0, 0, 0, 0, 0, 0, 1, 0, 0, 0, 0, 0, 0, 0, 0, 0, 0, 0, 0, 0, 0, 0, 0, 0, 1, 0, 0)",0
"the woman s a bitch , but the man s a psychopath .",High,Derogatory,Insulting and Offensive,Malicious,"(1, 0, 0, 0, 1, 0, 0, 0, 0, 0, 0, 0, 0, 0, 0, 0, 1, 0, 0, 0, 0, 0, 0, 0, 0, 0, 0, 0, 0, 0, 0, 0, 0, 0, 0, 0, 0)",0
"Oh, that was my dumbass mistake.",Low,Casual,Informal,Regretful,"(0, 0, 0, 0, 0, 0, 0, 0, 0, 0, 0, 0, 0, 0, 0, 0, 0, 0, 0, 0, 0, 0, 0, 0, 0, 0, 0, 0, 1, 0, 0, 0, 0, 0, 0, 0, 0)",0
"Next time, I will force you to eat your own shit.",High,Threatening,Aggressive and Vulgar,Malicious,"(0, 0, 0, 1, 0, 0, 0, 0, 0, 0, 0, 0, 0, 0, 0, 0, 0, 0, 0, 0, 0, 1, 0, 0, 0, 0, 0, 0, 0, 0, 0, 1, 0, 0, 0, 0, 0)",2
today was one of the most fucked up days of my life .,High,Negative,Vulgar,Frustrated,"(0, 0, 0, 0, 0, 0, 0, 0, 0, 0, 0, 0, 1, 0, 0, 0, 0, 0, 0, 0, 0, 0, 0, 1, 0, 0, 0, 0, 0, 0, 0, 1, 0, 0, 0, 0, 0)",2
"priceless, I hate that guy",Medium,Negative,Confrontational,Hostile,"(0, 1, 1, 0, 0, 0, 0, 0, 0, 0, 0, 0, 1, 0, 0, 0, 0, 0, 0, 0, 0, 0, 0, 0, 0, 0, 0, 0, 0, 0, 0, 0, 0, 0, 0, 0, 0)",1
stupid for a ball coach to make ten times what a teacher makes .,Medium,Disparaging,Critical,Disdainful,"(0, 0, 0, 0, 0, 0, 1, 1, 0, 0, 0, 0, 0, 0, 1, 0, 0, 0, 0, 0, 0, 0, 0, 0, 0, 0, 0, 0, 0, 0, 0, 0, 0, 0, 0, 0, 0)",0
"DIGIT year olds can be little shits too, doesn't mean you fight them.",Medium,Casual,Informal,Dismissive,"(0, 0, 0, 0, 0, 0, 0, 0, 0, 0, 1, 0, 0, 0, 0, 0, 0, 0, 0, 0, 0, 0, 0, 0, 0, 0, 0, 0, 1, 0, 0, 0, 0, 0, 0, 0, 0)",0
i never uttered or wrote that crap .,Low,Defensive,Informal,Denial,"(0, 0, 0, 0, 0, 0, 0, 0, 0, 0, 0, 0, 0, 0, 0, 0, 0, 0, 0, 0, 0, 0, 0, 0, 0, 0, 0, 0, 0, 0, 0, 0, 0, 0, 0, 1, 0)",0
my comment was more a diatribe about how there should be more outrage at home for this shit .,Low,Frustrated,Informative,Critical,"(0, 0, 0, 0, 0, 0, 1, 0, 0, 0, 0, 0, 0, 0, 0, 0, 0, 0, 0, 0, 0, 0, 0, 1, 0, 0, 0, 0, 0, 0, 0, 0, 0, 0, 0, 0, 0)",0
"ps, congradulations on recieving the bitch star, you definatly deserve it ryan.",High,Sarcastic,Insulting and Demeaning,Malicious,"(1, 0, 0, 0, 0, 0, 0, 0, 0, 1, 0, 0, 0, 0, 0, 0, 0, 0, 0, 0, 0, 0, 1, 0, 0, 0, 0, 0, 0, 0, 0, 0, 0, 0, 0, 0, 0)",0
that things that we use everyday aren't correct. wikipedia blows cock and so do you.,High,Aggressive,Vulgar and Offensive,Derogatory,"(0, 0, 0, 1, 1, 0, 0, 0, 0, 0, 0, 0, 0, 0, 0, 0, 1, 0, 0, 0, 0, 0, 0, 0, 0, 0, 0, 0, 0, 0, 0, 1, 0, 0, 0, 0, 0)",2
"not just a biologist , a fucking virologist ! .",High,Aggressive,Profane,Derogatory,"(0, 0, 0, 1, 1, 0, 0, 0, 0, 0, 0, 0, 0, 0, 0, 0, 0, 0, 0, 0, 0, 0, 0, 0, 0, 0, 0, 0, 0, 0, 0, 0, 1, 0, 0, 0, 0)",0
why do you guys do this shit out west ?,Medium,Inquisitive,Informal and Rude,Frustrated,"(0, 0, 0, 0, 0, 0, 0, 0, 0, 0, 0, 0, 0, 0, 0, 0, 0, 0, 0, 0, 0, 0, 0, 1, 0, 0, 0, 1, 0, 0, 0, 0, 0, 0, 0, 0, 0)",0
"not the rich and the government , but the people will be in shit street .",Low,Negative,Informal,Critical,"(0, 0, 0, 0, 0, 0, 1, 0, 0, 0, 0, 0, 1, 0, 0, 0, 0, 0, 0, 0, 0, 0, 0, 0, 0, 0, 0, 0, 0, 0, 0, 0, 0, 0, 0, 0, 0)",0
that stupid water pipe is just a fatal accident waiting to happen .,Medium,Negative,Derogatory,Critical,"(0, 0, 0, 0, 1, 0, 1, 0, 0, 0, 0, 0, 1, 0, 0, 0, 0, 0, 0, 0, 0, 0, 0, 0, 0, 0, 0, 0, 0, 0, 0, 0, 0, 0, 0, 0, 0)",0
eli5 why should governments give a fuck ? .,Low,Casual,Informal,Inquisitive,"(0, 0, 0, 0, 0, 0, 0, 0, 0, 0, 0, 0, 0, 0, 0, 0, 0, 0, 0, 0, 0, 0, 0, 0, 0, 0, 0, 1, 1, 0, 0, 0, 0, 0, 0, 0, 0)",0
"and go on saddam execution talk page, before you stink up the place.",Medium,Commanding,Aggressive,Contemptuous,"(0, 0, 0, 1, 0, 0, 0, 0, 1, 0, 0, 0, 0, 0, 0, 0, 0, 0, 0, 0, 0, 0, 0, 0, 0, 0, 0, 0, 0, 0, 0, 0, 0, 0, 0, 0, 0)",0
"i go there for work every few months , and i can assure you it fucking sucks .",Medium,Negative,Casual and Vulgar,Frustration,"(0, 0, 0, 0, 0, 0, 0, 0, 0, 0, 0, 0, 1, 0, 0, 0, 0, 0, 0, 0, 0, 0, 0, 0, 0, 0, 0, 0, 1, 0, 0, 1, 0, 0, 0, 0, 0)",2
these idiots are bound and determined to start a civil war !,Medium,Aggressive,Derogatory,Angry,"(0, 0, 0, 1, 1, 0, 0, 0, 0, 0, 0, 0, 0, 0, 0, 0, 0, 0, 0, 0, 0, 0, 0, 0, 0, 0, 0, 0, 0, 0, 0, 0, 0, 1, 0, 0, 0)",0
"abortion is not a fundamental right it is a proceedure , nothing more idiot",High,Insulting,Derogatory,Hostile,"(1, 1, 0, 0, 1, 0, 0, 0, 0, 0, 0, 0, 0, 0, 0, 0, 0, 0, 0, 0, 0, 0, 0, 0, 0, 0, 0, 0, 0, 0, 0, 0, 0, 0, 0, 0, 0)",1
his hypocrisy knowns no bounds .,Low,Critical,Strong,Negative,"(0, 0, 0, 0, 0, 0, 1, 0, 0, 0, 0, 0, 1, 0, 0, 0, 0, 0, 0, 0, 0, 0, 0, 0, 0, 0, 0, 0, 0, 0, 0, 0, 0, 0, 0, 0, 0)",0
what a bunch of sick lies !,High,Aggressive,Insulting,Hostile,"(1, 1, 0, 1, 0, 0, 0, 0, 0, 0, 0, 0, 0, 0, 0, 0, 0, 0, 0, 0, 0, 0, 0, 0, 0, 0, 0, 0, 0, 0, 0, 0, 0, 0, 0, 0, 0)",1
colin kaepernick is an idiot .,High,Insulting,Derogatory,Negative,"(1, 0, 0, 0, 1, 0, 0, 0, 0, 0, 0, 0, 1, 0, 0, 0, 0, 0, 0, 0, 0, 0, 0, 0, 0, 0, 0, 0, 0, 0, 0, 0, 0, 0, 0, 0, 0)",0
You are a pompous fool.,High,Insulting,Derogatory,Negative,"(1, 0, 0, 0, 1, 0, 0, 0, 0, 0, 0, 0, 1, 0, 0, 0, 0, 0, 0, 0, 0, 0, 0, 0, 0, 0, 0, 0, 0, 0, 0, 0, 0, 0, 0, 0, 0)",0
very few of these cophating clowns ever make cora requests for those case files .,Low,Neutral,Informal,Neutral,"(0, 0, 0, 0, 0, 0, 0, 0, 0, 0, 0, 0, 0, 0, 0, 0, 0, 0, 0, 0, 1, 0, 0, 0, 0, 0, 0, 0, 0, 0, 0, 0, 0, 0, 0, 0, 0)",0
"Target You are now a valid target, you nasty little shit!",High,Aggressive,Insulting and Offensive,Hostile,"(1, 1, 0, 1, 0, 0, 0, 0, 0, 0, 0, 0, 0, 0, 0, 0, 1, 0, 0, 0, 0, 0, 0, 0, 0, 0, 0, 0, 0, 0, 0, 0, 0, 0, 0, 0, 0)",1
i d love to live there if it weren t for the fucking california cost of living .,Medium,Frustrated,Informal,Negative,"(0, 0, 0, 0, 0, 0, 0, 0, 0, 0, 0, 0, 1, 0, 0, 0, 0, 0, 0, 0, 0, 0, 0, 1, 0, 0, 0, 0, 0, 0, 0, 0, 0, 0, 0, 0, 0)",0
"if you still think you re not living in a police state , wake the fuck up .",High,Aggressive,Vulgar,Hostile,"(0, 1, 0, 1, 0, 0, 0, 0, 0, 0, 0, 0, 0, 0, 0, 0, 0, 0, 0, 0, 0, 0, 0, 0, 0, 0, 0, 0, 0, 0, 0, 1, 0, 0, 0, 0, 0)",2
holy shit that article was filled with ads .,Medium,Informal,Cursing,Negative,"(0, 0, 0, 0, 0, 0, 0, 0, 0, 0, 0, 0, 1, 0, 0, 0, 0, 0, 0, 0, 0, 0, 0, 0, 0, 0, 0, 0, 0, 0, 0, 0, 0, 0, 0, 0, 0)",0
"Stop defending neo-Nazis, you fuck",High,Aggressive,Vulgar and Offensive,Angry,"(0, 0, 0, 1, 0, 0, 0, 0, 0, 0, 0, 0, 0, 0, 0, 0, 1, 0, 0, 0, 0, 0, 0, 0, 0, 0, 0, 0, 0, 0, 0, 1, 0, 1, 0, 0, 0)",2
my wife still gives me shit for it .,Low,Casual,Informal,Frustration,"(0, 0, 0, 0, 0, 0, 0, 0, 0, 0, 0, 0, 0, 0, 0, 0, 0, 0, 0, 0, 0, 0, 0, 0, 0, 0, 0, 0, 1, 0, 0, 0, 0, 0, 0, 0, 0)",0
"so i would really like it if people could stop acting like that 's why he got shot , it fucking isn 't .",High,Angry,Vulgar and Aggressive,Frustration and Disbelief,"(0, 0, 0, 1, 0, 0, 0, 0, 0, 0, 0, 0, 0, 0, 0, 0, 0, 0, 0, 0, 0, 0, 0, 0, 0, 0, 0, 0, 0, 0, 0, 1, 0, 1, 0, 0, 0)",2
"i 'm ready to actually do something to make this shit stop , but what can i do ?",Low,Frustrated,Informal,Determined,"(0, 0, 0, 0, 0, 0, 0, 0, 0, 0, 0, 0, 0, 0, 0, 0, 0, 0, 0, 0, 0, 0, 0, 1, 0, 0, 0, 0, 0, 0, 0, 0, 0, 0, 0, 0, 0)",0
"HEY CRETIN, LOOK UP YOUR HISTORY!",High,Derogatory,Insulting and Aggressive,Hostile,"(1, 1, 0, 1, 1, 0, 0, 0, 0, 0, 0, 0, 0, 0, 0, 0, 0, 0, 0, 0, 0, 0, 0, 0, 0, 0, 0, 0, 0, 0, 0, 0, 0, 0, 0, 0, 0)",1
That had more content and was going to be an article until you deleted it again dumbass.,High,Aggressive,Insulting and Condescending,Hostile,"(1, 1, 0, 1, 0, 0, 0, 0, 0, 0, 0, 0, 0, 1, 0, 0, 0, 0, 0, 0, 0, 0, 0, 0, 0, 0, 0, 0, 0, 0, 0, 0, 0, 0, 0, 0, 0)",1
What the hell are you on about?,Low,Confused/Inquisitive,Informal,Questioning,"(0, 0, 0, 0, 0, 0, 0, 0, 0, 0, 0, 0, 0, 0, 0, 0, 0, 0, 0, 0, 0, 0, 0, 0, 0, 0, 0, 1, 0, 1, 0, 0, 0, 0, 0, 0, 0)",0
the guy was fucking shot ! .,Medium,Explicit,Vulgar,Shocking,"(0, 0, 0, 0, 0, 0, 0, 0, 0, 0, 0, 0, 0, 0, 0, 0, 0, 0, 0, 0, 0, 0, 0, 0, 0, 0, 0, 0, 0, 0, 0, 1, 0, 0, 0, 0, 0)",2
"strong fiscal management , my ass , steve o .",Medium,Sarcastic,Vulgar and Dismissive,Contemptuous,"(0, 0, 0, 0, 0, 0, 0, 0, 1, 1, 1, 0, 0, 0, 0, 0, 0, 0, 0, 0, 0, 0, 0, 0, 0, 0, 0, 0, 0, 0, 0, 1, 0, 0, 0, 0, 0)",2
"no , i m pointing out that you are being a condescending ass about it , just like your euphoric brethren .",Medium,Condescending,Insulting and Contemptuous,Disdainful,"(1, 0, 0, 0, 0, 0, 0, 0, 1, 0, 0, 0, 0, 1, 1, 0, 0, 0, 0, 0, 0, 0, 0, 0, 0, 0, 0, 0, 0, 0, 0, 0, 0, 0, 0, 0, 0)",0
"sure he should get punished , but three fucking years ? .",Medium,Indignant,Mildly Offensive,Angry,"(0, 0, 0, 0, 0, 0, 0, 0, 0, 0, 0, 0, 0, 0, 0, 0, 1, 0, 0, 0, 0, 0, 0, 0, 0, 0, 0, 0, 0, 0, 0, 0, 0, 1, 0, 0, 0)",0
I'll Ignore you for now and your everyday idiotic anime likings and stop attacking you.,Medium,Dismissive,Critical,Contemptuous,"(0, 0, 0, 0, 0, 0, 1, 0, 1, 0, 1, 0, 0, 0, 0, 0, 0, 0, 0, 0, 0, 0, 0, 0, 0, 0, 0, 0, 0, 0, 0, 0, 0, 0, 0, 0, 0)",0
selective censorship and non reporting of factual and correct statements he makes of other leaders idiotic decisions !,High,Accusatory,Aggressive,Anger,"(0, 0, 0, 1, 0, 1, 0, 0, 0, 0, 0, 0, 0, 0, 0, 0, 0, 0, 0, 0, 0, 0, 0, 0, 0, 0, 0, 0, 0, 0, 0, 0, 0, 0, 0, 0, 0)",0
3 . you don 't fuck with a mommas boy,High,Aggressive,Inappropriate and Vulgar,Defensive,"(0, 0, 0, 1, 0, 0, 0, 0, 0, 0, 0, 0, 0, 0, 0, 0, 0, 0, 0, 0, 0, 0, 0, 0, 0, 0, 0, 0, 0, 0, 0, 1, 0, 0, 0, 1, 0)",2
get this ldiot out of there .,Medium,Commanding,Insulting,Negative,"(1, 0, 0, 0, 0, 0, 0, 0, 0, 0, 0, 0, 1, 0, 0, 0, 0, 0, 0, 0, 0, 0, 0, 0, 0, 0, 0, 0, 0, 0, 0, 0, 0, 0, 0, 0, 0)",0
"they should have fled , i feel that these guys are fucked , who turns themselves in to an angry mob ? .",Medium,Disapproving,Vulgar,Critical,"(0, 0, 0, 0, 0, 0, 1, 0, 0, 0, 0, 1, 0, 0, 0, 0, 0, 0, 0, 0, 0, 0, 0, 0, 0, 0, 0, 0, 0, 0, 0, 1, 0, 0, 0, 0, 0)",2
"shit looked like a music video with synced audio , and footage editing .",Low,Casual,Informal,Positive,"(0, 0, 0, 0, 0, 0, 0, 0, 0, 0, 0, 0, 0, 0, 0, 0, 0, 0, 0, 0, 0, 0, 0, 0, 0, 0, 0, 0, 1, 0, 0, 0, 0, 0, 0, 0, 1)",0
that s some pretty shit logic .,Medium,Dismissive,Informal,Negative,"(0, 0, 0, 0, 0, 0, 0, 0, 0, 0, 1, 0, 1, 0, 0, 0, 0, 0, 0, 0, 0, 0, 0, 0, 0, 0, 0, 0, 0, 0, 0, 0, 0, 0, 0, 0, 0)",0
reducing early voting from number down to number days sure is shitting all over the citizens of the united states .,Medium,Angry,Harsh and Disrespectful,Aggressive,"(0, 0, 0, 1, 0, 0, 0, 0, 0, 0, 0, 0, 0, 0, 0, 1, 0, 0, 0, 0, 0, 0, 0, 0, 0, 0, 0, 0, 0, 0, 0, 0, 0, 1, 0, 0, 0)",0
Delete my 200 articles Whhore,High,Aggressive,Insulting,Hostile,"(1, 1, 0, 1, 0, 0, 0, 0, 0, 0, 0, 0, 0, 0, 0, 0, 0, 0, 0, 0, 0, 0, 0, 0, 0, 0, 0, 0, 0, 0, 0, 0, 0, 0, 0, 0, 0)",1
"WHAT A FAGGOT, I'M GLAD HE'S DEAD!!!",High,Hostile,Insulting,Hateful,"(1, 1, 0, 0, 0, 0, 0, 0, 0, 0, 0, 0, 0, 0, 0, 0, 0, 0, 0, 0, 0, 0, 0, 0, 0, 0, 0, 0, 0, 0, 0, 0, 0, 0, 0, 0, 0)",1
lgbt whine and bitch all the way to the courts to have the twice declined decision overturned.,High,Derogatory,Abusive and Insensitive,Contemptuous,"(0, 0, 0, 0, 1, 0, 0, 0, 1, 0, 0, 0, 0, 0, 0, 0, 0, 0, 0, 0, 0, 0, 0, 0, 0, 0, 0, 0, 0, 0, 0, 0, 0, 0, 0, 0, 0)",0
"throwing his ass in jail is the best thing possible , since it protects others from his willful drunk driving .",Low,Assertive,Firm,Protective,"(0, 0, 0, 0, 0, 0, 0, 0, 0, 0, 0, 0, 0, 0, 0, 0, 0, 0, 0, 0, 0, 0, 0, 0, 0, 0, 0, 0, 0, 0, 0, 0, 0, 0, 0, 0, 0)",0
Queen Mary Mrs Windsor's granny was a bitch.,Medium,Derogatory,Vulgar,Contemptuous,"(0, 0, 0, 0, 1, 0, 0, 0, 1, 0, 0, 0, 0, 0, 0, 0, 0, 0, 0, 0, 0, 0, 0, 0, 0, 0, 0, 0, 0, 0, 0, 1, 0, 0, 0, 0, 0)",2
this piece of human garbage should rot in jail .,High,Dehumanizing,Aggressive,Rage,"(0, 0, 0, 1, 0, 0, 0, 0, 0, 0, 0, 0, 0, 0, 0, 0, 0, 0, 0, 0, 0, 0, 0, 0, 0, 0, 0, 0, 0, 0, 0, 0, 0, 0, 0, 0, 0)",0
"we shouldn t be shitting on his good name , and saying what he should , and shouldn t have done .",Medium,Assertive,Negative and Critical,Judgmental,"(0, 0, 0, 0, 0, 0, 1, 0, 0, 0, 0, 0, 1, 0, 0, 0, 0, 0, 0, 0, 0, 0, 0, 0, 0, 0, 1, 0, 0, 0, 0, 0, 0, 0, 0, 0, 0)",0
they don t give a shit about terrorism .,High,Disrespectful,Vulgar and Offensive,Negative,"(0, 0, 0, 0, 0, 0, 0, 0, 0, 0, 0, 0, 1, 0, 0, 1, 1, 0, 0, 0, 0, 0, 0, 0, 0, 0, 0, 0, 0, 0, 0, 1, 0, 0, 0, 0, 0)",2
top ten most relevant are you fucking sorry,High,Aggressive,Vulgar and Offensive,Angry,"(0, 0, 0, 1, 0, 0, 0, 0, 0, 0, 0, 0, 0, 0, 0, 0, 1, 0, 0, 0, 0, 0, 0, 0, 0, 0, 0, 0, 0, 0, 0, 1, 0, 1, 0, 0, 0)",2
"See all the many Google links, titled 'Wikipedia sucks.'",Low,Neutral,Informative,Negative,"(0, 0, 0, 0, 0, 0, 0, 0, 0, 0, 0, 0, 1, 0, 0, 0, 0, 0, 0, 0, 1, 0, 0, 0, 0, 0, 0, 0, 0, 0, 0, 0, 0, 0, 0, 0, 0)",0
"so again , unless you have something useful to say , fuck off .",High,Aggressive,Profane and Rude,Hostile,"(0, 1, 0, 1, 0, 0, 0, 0, 0, 0, 0, 0, 0, 0, 0, 0, 0, 0, 0, 0, 0, 0, 0, 0, 0, 0, 0, 0, 0, 0, 0, 0, 1, 0, 0, 0, 0)",1
so they don't give a flying fuck about long term effects.,High,Disrespectful,Vulgar and dismissive,Negative,"(0, 0, 0, 0, 0, 0, 0, 0, 0, 0, 1, 0, 1, 0, 0, 1, 0, 0, 0, 0, 0, 0, 0, 0, 0, 0, 0, 0, 0, 0, 0, 1, 0, 0, 0, 0, 0)",2
i 'm so fucking sick of reddit assuming people with a dissenting opinion are being paid by someone else .,High,Angry,Aggressive and Offensive,Resentful,"(0, 0, 0, 1, 0, 0, 0, 0, 0, 0, 0, 0, 0, 0, 0, 0, 1, 0, 0, 0, 0, 0, 0, 0, 0, 0, 0, 0, 0, 0, 0, 0, 0, 1, 0, 0, 0)",0
minorities bitch and moan when the police uphold the law .,High,Derogatory,Dehumanizing,Discriminatory,"(0, 0, 0, 0, 1, 0, 0, 0, 0, 0, 0, 0, 0, 0, 0, 0, 0, 0, 0, 0, 0, 0, 0, 0, 0, 0, 0, 0, 0, 0, 0, 0, 0, 0, 0, 0, 0)",0
You are an idiot and you can't block anyone.,High,Insulting,Derogatory,Condescending,"(1, 0, 0, 0, 1, 0, 0, 0, 0, 0, 0, 0, 0, 1, 0, 0, 0, 0, 0, 0, 0, 0, 0, 0, 0, 0, 0, 0, 0, 0, 0, 0, 0, 0, 0, 0, 0)",0
holy shit why is this not higher up ? ? ?,Low,Surprised,Informal,Frustration,"(0, 0, 0, 0, 0, 0, 0, 0, 0, 0, 0, 0, 0, 0, 0, 0, 0, 0, 0, 0, 0, 0, 0, 0, 0, 0, 0, 0, 0, 0, 0, 0, 0, 0, 0, 0, 0)",0
"careful , you just described the goonies , and that shit was classic .",Low,Casual,Informal,Positive,"(0, 0, 0, 0, 0, 0, 0, 0, 0, 0, 0, 0, 0, 0, 0, 0, 0, 0, 0, 0, 0, 0, 0, 0, 0, 0, 0, 0, 1, 0, 0, 0, 0, 0, 0, 0, 1)",0
"gawd , you are one massively ignorant fellow .",High,Insulting,Rude and Condescending,Contemptuous,"(1, 0, 0, 0, 0, 0, 0, 0, 1, 0, 0, 0, 0, 1, 0, 0, 0, 0, 0, 0, 0, 0, 0, 0, 0, 0, 0, 0, 0, 0, 0, 0, 0, 0, 0, 0, 0)",0
it 's just dumb fucking luck .,Medium,Casual,Vulgar,Negative,"(0, 0, 0, 0, 0, 0, 0, 0, 0, 0, 0, 0, 1, 0, 0, 0, 0, 0, 0, 0, 0, 0, 0, 0, 0, 0, 0, 0, 1, 0, 0, 1, 0, 0, 0, 0, 0)",2
who the fuck is pushing diversity on you ? .,Medium,Aggressive,Profane,Defensive,"(0, 0, 0, 1, 0, 0, 0, 0, 0, 0, 0, 0, 0, 0, 0, 0, 0, 0, 0, 0, 0, 0, 0, 0, 0, 0, 0, 0, 0, 0, 0, 0, 1, 0, 0, 1, 0)",0
Probably because NO ONE GIVES A FUCK ABOUT MISS UPTON.,High,Disrespectful,Vulgar and Confrontational,Hostile,"(0, 1, 1, 0, 0, 0, 0, 0, 0, 0, 0, 0, 0, 0, 0, 1, 0, 0, 0, 0, 0, 0, 0, 0, 0, 0, 0, 0, 0, 0, 0, 1, 0, 0, 0, 0, 0)",2
the object is to waste peoples time deconstructing your foolish effusions .,Medium,Dismissive,Condescending,Critical,"(0, 0, 0, 0, 0, 0, 1, 0, 0, 0, 1, 0, 0, 1, 0, 0, 0, 0, 0, 0, 0, 0, 0, 0, 0, 0, 0, 0, 0, 0, 0, 0, 0, 0, 0, 0, 0)",0
looks like the not fucking around crew is making decisions now .,Low,Casual,Informal,Assertive,"(0, 0, 0, 0, 0, 0, 0, 0, 0, 0, 0, 0, 0, 0, 0, 0, 0, 0, 0, 0, 0, 0, 0, 0, 0, 0, 0, 0, 1, 0, 0, 0, 0, 0, 0, 0, 0)",0
"that said , i hope they get a great attorney and sue the shit out of the cops .",Medium,Assertive,Aggressive,Vengeful,"(0, 0, 0, 1, 0, 0, 0, 0, 0, 0, 0, 0, 0, 0, 0, 0, 0, 0, 0, 0, 0, 0, 0, 0, 0, 0, 0, 0, 0, 0, 0, 0, 0, 0, 0, 0, 0)",0
Bullshit William Penn used the phrase too.,Low,Casual,Informal,Slight sarcasm,"(0, 0, 0, 0, 0, 0, 0, 0, 0, 0, 0, 0, 0, 0, 0, 0, 0, 0, 0, 0, 0, 0, 0, 0, 0, 0, 0, 0, 1, 0, 0, 0, 0, 0, 0, 0, 0)",0
"fuck it , we 'll do it live .",High,Aggressive,Vulgar and Dismissive,Defiant,"(0, 0, 0, 1, 0, 0, 0, 0, 0, 0, 1, 0, 0, 0, 0, 0, 0, 0, 0, 0, 0, 0, 0, 0, 0, 0, 0, 0, 0, 0, 0, 1, 0, 0, 1, 0, 0)",2
FUCK Why hasn't anyone included this information yet?,High,Aggressive,Profane,Frustration/Hostility,"(0, 0, 0, 1, 0, 0, 0, 0, 0, 0, 0, 0, 0, 0, 0, 0, 0, 0, 0, 0, 0, 0, 0, 0, 0, 0, 0, 0, 0, 0, 0, 0, 1, 0, 0, 0, 0)",0
it tastes like shit and i 've never even seen it available outside of five - star restaurants .,Medium,Negative,Colloquial,Disgust,"(0, 0, 0, 0, 0, 0, 0, 0, 0, 0, 0, 0, 1, 0, 0, 0, 0, 0, 0, 0, 0, 0, 0, 0, 0, 0, 0, 0, 0, 0, 0, 0, 0, 0, 0, 0, 0)",0
i have made the changes lets not let something this stupid happen again,Low,Assertive,Direct and Casual,Determined,"(0, 0, 0, 0, 0, 0, 0, 0, 0, 0, 0, 0, 0, 0, 0, 0, 0, 0, 0, 0, 0, 0, 0, 0, 0, 0, 0, 0, 1, 0, 0, 0, 0, 0, 0, 0, 0)",0
who the hell do you feminists think you are anyway ?,High,Aggressive,Confrontational and Insulting,Hostile,"(1, 1, 1, 1, 0, 0, 0, 0, 0, 0, 0, 0, 0, 0, 0, 0, 0, 0, 0, 0, 0, 0, 0, 0, 0, 0, 0, 0, 0, 0, 0, 0, 0, 0, 0, 0, 0)",1
. or the loud ass one - thousand ton beast roaring towards you howling its horn .,Medium,Aggressive,Vulgar and Threatening,Intimidating,"(0, 0, 0, 1, 0, 0, 0, 0, 0, 0, 0, 0, 0, 0, 0, 0, 0, 0, 0, 0, 0, 1, 0, 0, 0, 0, 0, 0, 0, 0, 0, 1, 0, 0, 0, 0, 0)",2
its one of those you don t know what your saying so i m correcting you cunts .,High,Confrontational,Insulting and Aggressive,Hostile,"(1, 1, 1, 1, 0, 0, 0, 0, 0, 0, 0, 0, 0, 0, 0, 0, 0, 0, 0, 0, 0, 0, 0, 0, 0, 0, 0, 0, 0, 0, 0, 0, 0, 0, 0, 0, 0)",1
likes to eat shit It's true and he told me himself!,High,Derogatory,Vulgar and Insulting,Malicious,"(1, 0, 0, 0, 1, 0, 0, 0, 0, 0, 0, 0, 0, 0, 0, 0, 0, 0, 0, 0, 0, 0, 0, 0, 0, 0, 0, 0, 0, 0, 0, 1, 0, 0, 0, 0, 0)",2
this administrations shit stinks as bad as the last ! .,Medium,Critical,Vulgar and Disrespectful,Negative,"(0, 0, 0, 0, 0, 0, 1, 0, 0, 0, 0, 0, 1, 0, 0, 1, 0, 0, 0, 0, 0, 0, 0, 0, 0, 0, 0, 0, 0, 0, 0, 1, 0, 0, 0, 0, 0)",2
There's a better answer to the question: the people that made the anime fucked up.,Medium,Blunt,Vulgar and Critical,Negative,"(0, 0, 0, 0, 0, 0, 1, 0, 0, 0, 0, 0, 1, 0, 0, 0, 0, 0, 0, 0, 0, 0, 0, 0, 0, 0, 0, 0, 0, 0, 0, 1, 0, 0, 0, 0, 0)",2
"they have all the fucking money , how am i supposed to earn my billions ? .",High,Frustrated,Vulgar,Envious,"(0, 0, 0, 0, 0, 0, 0, 0, 0, 0, 0, 0, 0, 0, 0, 0, 0, 0, 0, 0, 0, 0, 0, 1, 0, 0, 0, 0, 0, 0, 0, 1, 0, 0, 0, 0, 0)",2
that guy used to be a real dick .,Low,Casual,Informal,Negative,"(0, 0, 0, 0, 0, 0, 0, 0, 0, 0, 0, 0, 1, 0, 0, 0, 0, 0, 0, 0, 0, 0, 0, 0, 0, 0, 0, 0, 1, 0, 0, 0, 0, 0, 0, 0, 0)",0
p. s. i do own all of those pictures bitch .,High,Defiant,Insulting and Aggressive,Contemptuous,"(1, 0, 0, 1, 0, 0, 0, 0, 1, 0, 0, 0, 0, 0, 0, 0, 0, 0, 0, 0, 0, 0, 0, 0, 0, 0, 0, 0, 0, 0, 0, 0, 0, 0, 1, 0, 0)",1
"haha okay i m a sick fuck to find that entertaining , i ll see myself out .",High,Casual/Sarcastic,Vulgar and Offensive,Defiant/Provocative,"(0, 0, 0, 0, 0, 0, 0, 0, 0, 1, 0, 0, 0, 0, 0, 0, 1, 0, 0, 0, 0, 0, 0, 0, 0, 0, 0, 0, 1, 0, 0, 1, 0, 0, 1, 0, 0)",2
"food is really fucking cheap , jail time because people robbed stores rather than starve to death is not .",Medium,Casual/Informal,Vulgar/Insensitive,Negative/Insensitive,"(0, 0, 0, 0, 0, 0, 0, 0, 0, 0, 0, 0, 1, 0, 0, 0, 0, 0, 0, 0, 0, 0, 0, 0, 0, 0, 0, 0, 1, 0, 0, 1, 0, 0, 0, 0, 0)",2
only boneheads would buy into this stuff from the msm .,Medium,Dismissive,Insulting,Contemptuous,"(1, 0, 0, 0, 0, 0, 0, 0, 1, 0, 1, 0, 0, 0, 0, 0, 0, 0, 0, 0, 0, 0, 0, 0, 0, 0, 0, 0, 0, 0, 0, 0, 0, 0, 0, 0, 0)",0
randy johnson is a troll .,Low,Neutral,Informative,Negative,"(0, 0, 0, 0, 0, 0, 0, 0, 0, 0, 0, 0, 1, 0, 0, 0, 0, 0, 0, 0, 1, 0, 0, 0, 0, 0, 0, 0, 0, 0, 0, 0, 0, 0, 0, 0, 0)",0
this is a fuckingtzu tactic for shits sake .,High,Aggressive,Vulgar and Offensive,Angry,"(0, 0, 0, 1, 0, 0, 0, 0, 0, 0, 0, 0, 0, 0, 0, 0, 1, 0, 0, 0, 0, 0, 0, 0, 0, 0, 0, 0, 0, 0, 0, 1, 0, 1, 0, 0, 0)",2
Kind of a stupid response given the name of the article.,Low,Critical,Informal,Skeptical,"(0, 0, 0, 0, 0, 0, 1, 0, 0, 0, 0, 0, 0, 0, 0, 0, 0, 0, 0, 0, 0, 0, 0, 0, 0, 1, 0, 0, 0, 0, 0, 0, 0, 0, 0, 0, 0)",0
"daniel pantaleo , the worthless bag of shit who got away with murdering eric garner .",High,Angry,Insulting and derogatory,Hostile,"(1, 1, 0, 0, 1, 0, 0, 0, 0, 0, 0, 0, 0, 0, 0, 0, 0, 0, 0, 0, 0, 0, 0, 0, 0, 0, 0, 0, 0, 0, 0, 0, 0, 1, 0, 0, 0)",1
Gogo Dodo is a rogue admin that has sex with his father,High,Accusatory,Inflammatory and Offensive,Malicious,"(0, 0, 0, 0, 0, 1, 0, 0, 0, 0, 0, 0, 0, 0, 0, 0, 1, 0, 0, 0, 0, 0, 0, 0, 0, 0, 0, 0, 0, 0, 0, 0, 0, 0, 0, 0, 0)",0
he hasn t done shit for palestine .,Medium,Dismissive,Vulgar,Negative,"(0, 0, 0, 0, 0, 0, 0, 0, 0, 0, 1, 0, 1, 0, 0, 0, 0, 0, 0, 0, 0, 0, 0, 0, 0, 0, 0, 0, 0, 0, 0, 1, 0, 0, 0, 0, 0)",2
"i thought world leader just picked random shit to do , thank you for informing us ! .",Low,Sarcastic,Casual,Sarcastic,"(0, 0, 0, 0, 0, 0, 0, 0, 0, 1, 0, 0, 0, 0, 0, 0, 0, 0, 0, 0, 0, 0, 0, 0, 0, 0, 0, 0, 1, 0, 0, 0, 0, 0, 0, 0, 0)",0
Once again I'm SO glad that Wikipedia is not biased or filled with retarded children.,High,Derogatory,Offensive,Negative,"(0, 0, 0, 0, 1, 0, 0, 0, 0, 0, 0, 0, 1, 0, 0, 0, 1, 0, 0, 0, 0, 0, 0, 0, 0, 0, 0, 0, 0, 0, 0, 0, 0, 0, 0, 0, 0)",0
but redditors are too busy sucking bernie s dick to care .,Medium,Dismissive,Vulgar,Negative,"(0, 0, 0, 0, 0, 0, 0, 0, 0, 0, 1, 0, 1, 0, 0, 0, 0, 0, 0, 0, 0, 0, 0, 0, 0, 0, 0, 0, 0, 0, 0, 1, 0, 0, 0, 0, 0)",2
if you think a town in texas would cover this kind of shit up you 're insane .,Medium,Accusatory,Critical and Profane,Angry,"(0, 0, 0, 0, 0, 1, 1, 0, 0, 0, 0, 0, 0, 0, 0, 0, 0, 0, 0, 0, 0, 0, 0, 0, 0, 0, 0, 0, 0, 0, 0, 0, 1, 1, 0, 0, 0)",0
