Sentence,Toxicity Level,Tone,Language,Implied Sentiment,Keyword Vector,K_means_cluster
the people who drafted this are probably privately the most fucked up of all .,High,Derogatory,Vulgar and Insulting,Contemptuous,"(1, 0, 0, 0, 1, 0, 0, 0, 1, 0, 0, 0, 0, 0, 0, 0, 0, 0, 0, 0, 0, 0, 0, 0, 0, 0, 0, 0, 0, 0, 0, 1, 0, 0, 0, 0, 0)",2
the person was a piece of shit to begin with .,High,Derogatory,Insulting and Aggressive,Hostile,"(1, 1, 0, 1, 1, 0, 0, 0, 0, 0, 0, 0, 0, 0, 0, 0, 0, 0, 0, 0, 0, 0, 0, 0, 0, 0, 0, 0, 0, 0, 0, 0, 0, 0, 0, 0, 0)",1
"the rewritten rules are stupidly insane , and any support of them follows suit .",High,Dismissive,Insulting and Derisive,Hostile,"(1, 1, 0, 0, 0, 0, 0, 0, 0, 0, 1, 0, 0, 0, 0, 0, 0, 1, 0, 0, 0, 0, 0, 0, 0, 0, 0, 0, 0, 0, 0, 0, 0, 0, 0, 0, 0)",1
the shit in san bernardino was an office dispute that turned really ugly .,Medium,Casual and Vulgar,Informal and Offensive,Negative,"(0, 0, 0, 0, 0, 0, 0, 0, 0, 0, 0, 0, 1, 0, 0, 0, 1, 0, 0, 0, 0, 0, 0, 0, 0, 0, 0, 0, 1, 0, 0, 1, 0, 0, 0, 0, 0)",2
the stupid is if the pco thinks they can win by denigrating wynee and not offering a positive viable alternative.,High,Dismissive,Confrontational and Insulting,Hostile,"(1, 1, 1, 0, 0, 0, 0, 0, 0, 0, 1, 0, 0, 0, 0, 0, 0, 0, 0, 0, 0, 0, 0, 0, 0, 0, 0, 0, 0, 0, 0, 0, 0, 0, 0, 0, 0)",1
the who can t do shit but try to educate people.,Medium,Sarcastic,Dismissive and Vulgar,Derogatory,"(0, 0, 0, 0, 1, 0, 0, 0, 0, 1, 1, 0, 0, 0, 0, 0, 0, 0, 0, 0, 0, 0, 0, 0, 0, 0, 0, 0, 0, 0, 0, 1, 0, 0, 0, 0, 0)",2
their shit is cheap but its of such awful quality that you re better off getting the more expensive item .,Medium,Critical,Informal and Vulgar,Derogatory,"(0, 0, 0, 0, 1, 0, 1, 0, 0, 0, 0, 0, 0, 0, 0, 0, 0, 0, 0, 0, 0, 0, 0, 0, 0, 0, 0, 0, 0, 0, 0, 1, 0, 0, 0, 0, 0)",2
these jerks have always been around .,Medium,Derogatory,Disparaging,Contemptuous,"(0, 0, 0, 0, 1, 0, 0, 1, 1, 0, 0, 0, 0, 0, 0, 0, 0, 0, 0, 0, 0, 0, 0, 0, 0, 0, 0, 0, 0, 0, 0, 0, 0, 0, 0, 0, 0)",0
they 're living streaming on bbc for fucks sake .,Medium,Frustrated,Profane,Annoyance,"(0, 0, 0, 0, 0, 0, 0, 0, 0, 0, 0, 0, 0, 0, 0, 0, 0, 0, 0, 0, 0, 0, 0, 1, 0, 0, 0, 0, 0, 0, 0, 0, 1, 0, 0, 0, 0)",0
they get attention which is exactly what you fuck wits are giving them .,High,Aggressive,Confrontational and Insulting,Hostile,"(1, 1, 1, 1, 0, 0, 0, 0, 0, 0, 0, 0, 0, 0, 0, 0, 0, 0, 0, 0, 0, 0, 0, 0, 0, 0, 0, 0, 0, 0, 0, 0, 0, 0, 0, 0, 0)",1
they have been involved in so many fucked up things since its creation .,High,Accusatory,Vulgar and Demeaning,Critical,"(0, 0, 0, 0, 0, 1, 1, 0, 0, 0, 0, 0, 0, 0, 0, 0, 0, 0, 0, 0, 0, 0, 1, 0, 0, 0, 0, 0, 0, 0, 0, 1, 0, 0, 0, 0, 0)",2
they need stop tratening people like morons .,High,Aggressive,Insulting and Confrontational,Hostile,"(1, 1, 1, 1, 0, 0, 0, 0, 0, 0, 0, 0, 0, 0, 0, 0, 0, 0, 0, 0, 0, 0, 0, 0, 0, 0, 0, 0, 0, 0, 0, 0, 0, 0, 0, 0, 0)",1
they re a tinfoil wearing publication owned by a fucking cult led by a known tax evader .,High,Derogatory,Vulgar and Insulting,Contemptuous,"(1, 0, 0, 0, 1, 0, 0, 0, 1, 0, 0, 0, 0, 0, 0, 0, 0, 0, 0, 0, 0, 0, 0, 0, 0, 0, 0, 0, 0, 0, 0, 1, 0, 0, 0, 0, 0)",2
they re both fucked up .,High,Aggressive,Vulgar and Insulting,Hostile,"(1, 1, 0, 1, 0, 0, 0, 0, 0, 0, 0, 0, 0, 0, 0, 0, 0, 0, 0, 0, 0, 0, 0, 0, 0, 0, 0, 0, 0, 0, 0, 1, 0, 0, 0, 0, 0)",1
"they really don t fit in , since they are just fucking immature assholes .",High,Aggressive,Confrontational and Vulgar,Hostile,"(0, 1, 1, 1, 0, 0, 0, 0, 0, 0, 0, 0, 0, 0, 0, 0, 0, 0, 0, 0, 0, 0, 0, 0, 0, 0, 0, 0, 0, 0, 0, 1, 0, 0, 0, 0, 0)",1
they will end up in hell !,High,Threatening,Aggressive,Hostile,"(0, 1, 0, 1, 0, 0, 0, 0, 0, 0, 0, 0, 0, 0, 0, 0, 0, 0, 0, 0, 0, 1, 0, 0, 0, 0, 0, 0, 0, 0, 0, 0, 0, 0, 0, 0, 0)",1
they will find someone as retarded as him to become the glorious leader .,High,Derogatory,Offensive and Insulting,Disrespectful,"(1, 0, 0, 0, 1, 0, 0, 0, 0, 0, 0, 0, 0, 0, 0, 1, 1, 0, 0, 0, 0, 0, 0, 0, 0, 0, 0, 0, 0, 0, 0, 0, 0, 0, 0, 0, 0)",0
this guy is a total sellout with no brains for business and lacks the ability of forward thinking .,High,Disparaging,Derogatory and Insulting,Contemptuous,"(1, 0, 0, 0, 1, 0, 0, 1, 1, 0, 0, 0, 0, 0, 0, 0, 0, 0, 0, 0, 0, 0, 0, 0, 0, 0, 0, 0, 0, 0, 0, 0, 0, 0, 0, 0, 0)",0
this has to be the dumbest editorial of all time.,Medium,Dismissive,Insulting,Negative,"(1, 0, 0, 0, 0, 0, 0, 0, 0, 0, 1, 0, 1, 0, 0, 0, 0, 0, 0, 0, 0, 0, 0, 0, 0, 0, 0, 0, 0, 0, 0, 0, 0, 0, 0, 0, 0)",0
"this is a joke , are you all fucking retards ? .",High,Aggressive,Offensive and Insulting,Hostile,"(1, 1, 0, 1, 0, 0, 0, 0, 0, 0, 0, 0, 0, 0, 0, 0, 1, 0, 0, 0, 0, 0, 0, 0, 0, 0, 0, 0, 0, 0, 0, 0, 0, 0, 0, 0, 0)",1
this is nothing short of a hateful whine by sore loser who didnt get her way.,High,Derogatory,Disparaging and Insulting,Contemptuous,"(1, 0, 0, 0, 1, 0, 0, 1, 1, 0, 0, 0, 0, 0, 0, 0, 0, 0, 0, 0, 0, 0, 0, 0, 0, 0, 0, 0, 0, 0, 0, 0, 0, 0, 0, 0, 0)",0
this is possibly the most ignorant and oversimplified thing i have ever read.,Medium,Dismissive,Confrontational and Insulting,Disdainful,"(1, 0, 1, 0, 0, 0, 0, 0, 0, 0, 1, 0, 0, 0, 1, 0, 0, 0, 0, 0, 0, 0, 0, 0, 0, 0, 0, 0, 0, 0, 0, 0, 0, 0, 0, 0, 0)",0
this is scaring the shit out of me .,Medium,Fearful,Vulgar,Anxious,"(0, 0, 0, 0, 0, 0, 0, 0, 0, 0, 0, 0, 0, 0, 0, 0, 0, 0, 0, 0, 0, 0, 0, 0, 0, 0, 0, 0, 0, 0, 0, 1, 0, 0, 0, 0, 0)",2
this is some twilight zone shit,Medium,Frustrated,Informal and Explicit,Disbelief,"(0, 0, 0, 0, 0, 0, 0, 0, 0, 0, 0, 0, 0, 0, 0, 0, 0, 0, 0, 0, 0, 0, 0, 1, 0, 0, 0, 0, 0, 0, 0, 0, 0, 0, 0, 0, 0)",0
this is the exact reason most people think the environmentalists are crazy !,Medium,Derogatory,Dismissive,Disdainful,"(0, 0, 0, 0, 1, 0, 0, 0, 0, 0, 1, 0, 0, 0, 1, 0, 0, 0, 0, 0, 0, 0, 0, 0, 0, 0, 0, 0, 0, 0, 0, 0, 0, 0, 0, 0, 0)",0
"this is the exact reason we need a national death penalty , his sentence should have been a short rope !",High,Aggressive,Violent and Condemning,Hostile,"(0, 1, 0, 1, 0, 0, 0, 0, 0, 0, 0, 0, 0, 0, 0, 0, 0, 0, 0, 0, 0, 0, 0, 0, 0, 0, 0, 0, 0, 0, 0, 0, 0, 0, 0, 0, 0)",1
this is what happens when you gather a bunch of illiterate ignorant fucks and brainwash them with bs and propaganda .,High,Hostile,Confrontational and Vulgar,Contemptuous,"(0, 1, 1, 0, 0, 0, 0, 0, 1, 0, 0, 0, 0, 0, 0, 0, 0, 0, 0, 0, 0, 0, 0, 0, 0, 0, 0, 0, 0, 0, 0, 1, 0, 0, 0, 0, 0)",2
this is why the country is fucked up .,High,Angry,Profane and Critical,Disdainful,"(0, 0, 0, 0, 0, 0, 1, 0, 0, 0, 0, 0, 0, 0, 1, 0, 0, 0, 0, 0, 0, 0, 0, 0, 0, 0, 0, 0, 0, 0, 0, 0, 1, 1, 0, 0, 0)",0
this isn t about agreeing on blowing shit up .,Medium,Aggressive,Vulgar,Frustrated,"(0, 0, 0, 1, 0, 0, 0, 0, 0, 0, 0, 0, 0, 0, 0, 0, 0, 0, 0, 0, 0, 0, 0, 1, 0, 0, 0, 0, 0, 0, 0, 1, 0, 0, 0, 0, 0)",2
this junk talk is tiresome .,Medium,Frustrated,Dismissive and Critical,Negative,"(0, 0, 0, 0, 0, 0, 1, 0, 0, 0, 1, 0, 1, 0, 0, 0, 0, 0, 0, 0, 0, 0, 0, 1, 0, 0, 0, 0, 0, 0, 0, 0, 0, 0, 0, 0, 0)",0
this populist crap is just the psych majors manipulating you .,Medium,Dismissive,Confrontational and Derogatory,Cynical,"(0, 0, 1, 0, 1, 0, 0, 0, 0, 0, 1, 0, 0, 0, 0, 0, 0, 0, 0, 0, 0, 0, 0, 0, 0, 0, 0, 0, 0, 0, 0, 0, 0, 0, 0, 0, 0)",0
this shit has been happening for generations .,Medium,Frustrated,Informal and Profane,Annoyed,"(0, 0, 0, 0, 0, 0, 0, 0, 0, 0, 0, 0, 0, 0, 0, 0, 0, 0, 0, 0, 0, 0, 0, 1, 0, 0, 0, 0, 0, 0, 0, 0, 1, 0, 0, 0, 0)",0
this shit is overwhelming to think about .,Medium,Frustrated,Informal and Vulgar,Overwhelmed,"(0, 0, 0, 0, 0, 0, 0, 0, 0, 0, 0, 0, 0, 0, 0, 0, 0, 0, 0, 0, 0, 0, 0, 1, 0, 0, 0, 0, 0, 0, 0, 1, 0, 0, 0, 0, 0)",2
this sick fuck is just a sociopath who doesn t want to face the consequences for his actions .,High,Aggressive,Explicit and Insulting,Hostile,"(1, 1, 0, 1, 0, 0, 0, 0, 0, 0, 0, 0, 0, 0, 0, 0, 0, 0, 0, 0, 0, 0, 0, 0, 0, 0, 0, 0, 0, 0, 0, 0, 0, 0, 0, 0, 0)",1
this whole place is fucking corrupt .,High,Angry,Aggressive and Vulgar,Hostile,"(0, 1, 0, 1, 0, 0, 0, 0, 0, 0, 0, 0, 0, 0, 0, 0, 0, 0, 0, 0, 0, 0, 0, 0, 0, 0, 0, 0, 0, 0, 0, 1, 0, 1, 0, 0, 0)",2
"those are truly repugnant , and there plenty out there on both sides on the idiotdriven social networks .",High,Judgmental,Insulting,Derisive,"(1, 0, 0, 0, 0, 0, 0, 0, 0, 0, 0, 0, 0, 0, 0, 0, 0, 1, 0, 0, 0, 0, 0, 0, 0, 0, 1, 0, 0, 0, 0, 0, 0, 0, 0, 0, 0)",0
time to cut the credits and also cut the crap.,Medium,Dismissive,Informal and Vulgar,Frustrated,"(0, 0, 0, 0, 0, 0, 0, 0, 0, 0, 1, 0, 0, 0, 0, 0, 0, 0, 0, 0, 0, 0, 0, 1, 0, 0, 0, 0, 0, 0, 0, 1, 0, 0, 0, 0, 0)",2
to suggest otherwise is stupidly inflammatory .,Medium,Criticizing,Inflammatory and Insulting,Negative,"(1, 0, 0, 0, 0, 0, 0, 0, 0, 0, 0, 0, 1, 0, 0, 0, 0, 0, 0, 0, 0, 0, 0, 0, 0, 0, 0, 0, 0, 0, 0, 0, 0, 0, 0, 0, 0)",0
treats their murder victims like garbage while living their life pretending they are normal .,High,Accusatory,Graphic and Accusatory,Condemnatory,"(0, 0, 0, 0, 0, 1, 0, 0, 0, 0, 0, 0, 0, 0, 0, 0, 0, 0, 0, 1, 0, 0, 0, 0, 0, 0, 0, 0, 0, 0, 0, 0, 0, 0, 0, 0, 0)",0
use your own name to comment in public or i will be forced to call you a coward .,Medium,Threatening,Confrontational,Aggressive,"(0, 0, 1, 1, 0, 0, 0, 0, 0, 0, 0, 0, 0, 0, 0, 0, 0, 0, 0, 0, 0, 1, 0, 0, 0, 0, 0, 0, 0, 0, 0, 0, 0, 0, 0, 0, 0)",1
"useful idiots ) of course , the russians are still at it thats what they do regards .",Medium,Accusatory,Derisive and Insulting,Disparaging,"(1, 0, 0, 0, 0, 1, 0, 1, 0, 0, 0, 0, 0, 0, 0, 0, 0, 1, 0, 0, 0, 0, 0, 0, 0, 0, 0, 0, 0, 0, 0, 0, 0, 0, 0, 0, 0)",0
"we had to find some use for that damn lock box , sure as shit didn t put money in it .",Medium,Frustrated,Casual and Profane,Annoyed,"(0, 0, 0, 0, 0, 0, 0, 0, 0, 0, 0, 0, 0, 0, 0, 0, 0, 0, 0, 0, 0, 0, 0, 1, 0, 0, 0, 0, 1, 0, 0, 0, 1, 0, 0, 0, 0)",0
we rely on our government to protect us the military yet conservatives aren 't bitching about that .,Medium,Sarcastic,Informal and Derogatory,Critical,"(0, 0, 0, 0, 1, 0, 1, 0, 0, 1, 0, 0, 0, 0, 0, 0, 0, 0, 0, 0, 0, 0, 0, 0, 0, 0, 0, 0, 0, 0, 0, 0, 0, 0, 0, 0, 0)",0
we should answer those ads and then sabotage the fuck out of the equipment.,High,Aggressive,Vulgar and Destructive,Malicious,"(0, 0, 0, 1, 0, 0, 0, 0, 0, 0, 0, 0, 0, 0, 0, 0, 0, 0, 0, 0, 0, 0, 0, 0, 0, 0, 0, 0, 0, 0, 0, 1, 0, 0, 0, 0, 0)",2
"well no fucking shit , i can't believe people are only starting to realise this .",High,Sarcastic and Derisive,Profane and Condescending,Angry,"(0, 0, 0, 0, 0, 0, 0, 0, 0, 1, 0, 0, 0, 1, 0, 0, 0, 1, 0, 0, 0, 0, 0, 0, 0, 0, 0, 0, 0, 0, 0, 0, 1, 1, 0, 0, 0)",0
well they fucked up youtube hard .,Medium,Aggressive,Profane and Blunt,Critical,"(0, 0, 0, 1, 0, 0, 1, 0, 0, 0, 0, 0, 0, 0, 0, 0, 0, 0, 0, 0, 0, 0, 0, 0, 0, 0, 0, 0, 0, 0, 0, 0, 1, 0, 0, 0, 0)",0
"weve become too accepting of her nonsense , which fosters hate .",Medium,Critical,Disparaging,Negative,"(0, 0, 0, 0, 0, 0, 1, 1, 0, 0, 0, 0, 1, 0, 0, 0, 0, 0, 0, 0, 0, 0, 0, 0, 0, 0, 0, 0, 0, 0, 0, 0, 0, 0, 0, 0, 0)",0
what 's with these people coming on here and saying this shit ?,Medium,Frustrated,Informal and Vulgar,Annoyed,"(0, 0, 0, 0, 0, 0, 0, 0, 0, 0, 0, 0, 0, 0, 0, 0, 0, 0, 0, 0, 0, 0, 0, 1, 0, 0, 0, 0, 0, 0, 0, 1, 0, 0, 0, 0, 0)",2
what an arse hole you are !,High,Aggressive,Insulting and Derogatory,Hostile,"(1, 1, 0, 1, 1, 0, 0, 0, 0, 0, 0, 0, 0, 0, 0, 0, 0, 0, 0, 0, 0, 0, 0, 0, 0, 0, 0, 0, 0, 0, 0, 0, 0, 0, 0, 0, 0)",1
what kind of really really stupid plan is that ?,Medium,Condescending,Insulting,Disparaging,"(1, 0, 0, 0, 0, 0, 0, 1, 0, 0, 0, 0, 0, 1, 0, 0, 0, 0, 0, 0, 0, 0, 0, 0, 0, 0, 0, 0, 0, 0, 0, 0, 0, 0, 0, 0, 0)",0
what kind of shit did you put on my phone with that first link ? .,High,Confrontational,Vulgar and Accusatory,Hostile,"(0, 1, 1, 0, 0, 1, 0, 0, 0, 0, 0, 0, 0, 0, 0, 0, 0, 0, 0, 0, 0, 0, 0, 0, 0, 0, 0, 0, 0, 0, 0, 1, 0, 0, 0, 0, 0)",2
what kind of shit post is this ? .,Medium,Disdainful,Vulgar and Dismissive,Negative,"(0, 0, 0, 0, 0, 0, 0, 0, 0, 0, 1, 0, 1, 0, 1, 0, 0, 0, 0, 0, 0, 0, 0, 0, 0, 0, 0, 0, 0, 0, 0, 1, 0, 0, 0, 0, 0)",2
what s the fucking point of wearing them ? .,High,Frustrated,Vulgar and Aggressive,Disparaging,"(0, 0, 0, 1, 0, 0, 0, 1, 0, 0, 0, 0, 0, 0, 0, 0, 0, 0, 0, 0, 0, 0, 0, 1, 0, 0, 0, 0, 0, 0, 0, 1, 0, 0, 0, 0, 0)",2
what the actual fucking hell does it matter?,High,Aggressive,Profane and Confrontational,Frustrated,"(0, 0, 1, 1, 0, 0, 0, 0, 0, 0, 0, 0, 0, 0, 0, 0, 0, 0, 0, 0, 0, 0, 0, 1, 0, 0, 0, 0, 0, 0, 0, 0, 1, 0, 0, 0, 0)",1
"what the fuck did you do to my free images like this one , , you lazy shit .",High,Aggressive,Profane and Insulting,Hostile,"(1, 1, 0, 1, 0, 0, 0, 0, 0, 0, 0, 0, 0, 0, 0, 0, 0, 0, 0, 0, 0, 0, 0, 0, 0, 0, 0, 0, 0, 0, 0, 0, 1, 0, 0, 0, 0)",1
what the fuck do you mean cornered ? .,High,Aggressive,Profane and Confrontational,Hostile,"(0, 1, 1, 1, 0, 0, 0, 0, 0, 0, 0, 0, 0, 0, 0, 0, 0, 0, 0, 0, 0, 0, 0, 0, 0, 0, 0, 0, 0, 0, 0, 0, 1, 0, 0, 0, 0)",1
what the fuck is this guy doing,High,Aggressive,Profane and Disrespectful,Frustrated,"(0, 0, 0, 1, 0, 0, 0, 0, 0, 0, 0, 0, 0, 0, 0, 1, 0, 0, 0, 0, 0, 0, 0, 1, 0, 0, 0, 0, 0, 0, 0, 0, 1, 0, 0, 0, 0)",0
what the fuck is this news story ? .,High,Aggressive,Profane and Disrespectful,Hostile,"(0, 1, 0, 1, 0, 0, 0, 0, 0, 0, 0, 0, 0, 0, 0, 1, 0, 0, 0, 0, 0, 0, 0, 0, 0, 0, 0, 0, 0, 0, 0, 0, 1, 0, 0, 0, 0)",1
what the fuck is wrong with australia ? .,High,Aggressive,Vulgar and Confrontational,Hostile,"(0, 1, 1, 1, 0, 0, 0, 0, 0, 0, 0, 0, 0, 0, 0, 0, 0, 0, 0, 0, 0, 0, 0, 0, 0, 0, 0, 0, 0, 0, 0, 1, 0, 0, 0, 0, 0)",1
what the fuck is wrong with you guys,High,Angry,Offensive and Confrontational,Hostile,"(0, 1, 1, 0, 0, 0, 0, 0, 0, 0, 0, 0, 0, 0, 0, 0, 1, 0, 0, 0, 0, 0, 0, 0, 0, 0, 0, 0, 0, 0, 0, 0, 0, 1, 0, 0, 0)",1
what the heck is this about ?,Low,Inquisitive,Informal,Confused,"(0, 0, 0, 0, 0, 0, 0, 0, 0, 0, 0, 0, 0, 0, 0, 0, 0, 0, 0, 0, 0, 0, 0, 0, 0, 0, 0, 1, 0, 0, 0, 0, 0, 0, 0, 0, 0)",0
what the hell is wrong with people .,Medium,Frustrated,Confrontational,Annoyed,"(0, 0, 1, 0, 0, 0, 0, 0, 0, 0, 0, 0, 0, 0, 0, 0, 0, 0, 0, 0, 0, 0, 0, 1, 0, 0, 0, 0, 0, 0, 0, 0, 0, 0, 0, 0, 0)",0
whats really pathetic is how you jump to conclusions .,Medium,Condescending,Derogatory and Judgmental,Critical,"(0, 0, 0, 0, 1, 0, 1, 0, 0, 0, 0, 0, 0, 1, 0, 0, 0, 0, 0, 0, 0, 0, 0, 0, 0, 0, 1, 0, 0, 0, 0, 0, 0, 0, 0, 0, 0)",0
"whats the title of this report , no shit ? .",Medium,Dismissive,Casual and Vulgar,Frustrated,"(0, 0, 0, 0, 0, 0, 0, 0, 0, 0, 1, 0, 0, 0, 0, 0, 0, 0, 0, 0, 0, 0, 0, 1, 0, 0, 0, 0, 1, 0, 0, 1, 0, 0, 0, 0, 0)",2
when i was your age and starting to realize all this shit i became very depressed and it sucked.,Medium,Reflective,Informal and Crude,Negative,"(0, 0, 0, 0, 0, 0, 0, 0, 0, 0, 0, 0, 1, 0, 0, 0, 0, 0, 0, 0, 0, 0, 0, 0, 0, 0, 0, 0, 0, 0, 0, 0, 0, 0, 0, 0, 0)",0
wheres dis schmuck get his degree from ?,Medium,Condescending,Casual and Insulting,Disdainful,"(1, 0, 0, 0, 0, 0, 0, 0, 0, 0, 0, 0, 0, 1, 1, 0, 0, 0, 0, 0, 0, 0, 0, 0, 0, 0, 0, 0, 1, 0, 0, 0, 0, 0, 0, 0, 0)",0
who the fuck cares whose fault it is ?,High,Apathetic,Profane and Dismissive,Indifferent,"(0, 0, 0, 0, 0, 0, 0, 0, 0, 0, 1, 0, 0, 0, 0, 0, 0, 0, 0, 0, 0, 0, 0, 0, 0, 0, 0, 0, 0, 0, 0, 0, 1, 0, 0, 0, 0)",0
why can 't they just fucking give the guy credit for voting no ?,Medium,Frustrated,Aggressive,Annoyed,"(0, 0, 0, 1, 0, 0, 0, 0, 0, 0, 0, 0, 0, 0, 0, 0, 0, 0, 0, 0, 0, 0, 0, 1, 0, 0, 0, 0, 0, 0, 0, 0, 0, 0, 0, 0, 0)",0
"why does it bother you , fuckface ?",High,Aggressive,Insulting and Derogatory,Hostile,"(1, 1, 0, 1, 1, 0, 0, 0, 0, 0, 0, 0, 0, 0, 0, 0, 0, 0, 0, 0, 0, 0, 0, 0, 0, 0, 0, 0, 0, 0, 0, 0, 0, 0, 0, 0, 0)",1
why is reddit so fucking biased ?,Medium,Frustrated,Controversial and Profane,Critical,"(0, 0, 0, 0, 0, 0, 1, 0, 0, 0, 0, 0, 0, 0, 0, 0, 0, 0, 0, 0, 0, 0, 0, 1, 0, 0, 0, 0, 0, 0, 0, 0, 1, 0, 0, 0, 0)",0
why is the scale of that graphed so fucked up ? .,Medium,Frustrated,Profane and Confrontational,Annoyed,"(0, 0, 1, 0, 0, 0, 0, 0, 0, 0, 0, 0, 0, 0, 0, 0, 0, 0, 0, 0, 0, 0, 0, 1, 0, 0, 0, 0, 0, 0, 0, 0, 1, 0, 0, 0, 0)",0
why the fuck did they give some ufo hack interview time ? .,High,Aggressive,Profane and Dismissive,Contemptuous,"(0, 0, 0, 1, 0, 0, 0, 0, 1, 0, 1, 0, 0, 0, 0, 0, 0, 0, 0, 0, 0, 0, 0, 0, 0, 0, 0, 0, 0, 0, 0, 0, 1, 0, 0, 0, 0)",0
why the fuck does everyone hate syria so much ? .,High,Angry,Vulgar and Confrontational,Frustration,"(0, 0, 1, 0, 0, 0, 0, 0, 0, 0, 0, 0, 0, 0, 0, 0, 0, 0, 0, 0, 0, 0, 0, 0, 0, 0, 0, 0, 0, 0, 0, 1, 0, 1, 0, 0, 0)",2
why the fuck haven 't they condemned north korea ?,High,Angry,Profane and Confrontational,Frustrated,"(0, 0, 1, 0, 0, 0, 0, 0, 0, 0, 0, 0, 0, 0, 0, 0, 0, 0, 0, 0, 0, 0, 0, 1, 0, 0, 0, 0, 0, 0, 0, 0, 1, 1, 0, 0, 0)",0
wow . what the fuck where they thinking when they named that cleaning product . seriously . &gt . &lt,Medium,Astonished,Vulgar,Disapproving,"(0, 0, 0, 0, 0, 0, 0, 0, 0, 0, 0, 1, 0, 0, 0, 0, 0, 0, 0, 0, 0, 0, 0, 0, 0, 0, 0, 0, 0, 0, 0, 1, 0, 0, 0, 0, 0)",2
wtf ? ? missouri needs to catch the fuck up like right now .,Medium,Frustrated,Profane and Aggressive,Irritated,"(0, 0, 0, 1, 0, 0, 0, 0, 0, 0, 0, 0, 0, 0, 0, 0, 0, 0, 0, 0, 0, 0, 0, 1, 0, 0, 0, 0, 0, 0, 0, 0, 1, 0, 0, 0, 0)",0
wtf is this shit a self selected internet poll quoted as if it were a real statistic ? .,High,Aggressive,Profane and Dismissive,Contemptuous,"(0, 0, 0, 1, 0, 0, 0, 0, 1, 0, 1, 0, 0, 0, 0, 0, 0, 0, 0, 0, 0, 0, 0, 0, 0, 0, 0, 0, 0, 0, 0, 0, 1, 0, 0, 0, 0)",0
"yeah , comparitively fuck all because they have loads of offshore hidden bank accounts and smart accountants ? .",Medium,Frustrated,Crude and Accusatory,Resentful,"(0, 0, 0, 0, 0, 1, 0, 0, 0, 0, 0, 0, 0, 0, 0, 0, 0, 0, 0, 0, 0, 0, 0, 1, 0, 0, 0, 0, 0, 0, 0, 0, 0, 0, 0, 0, 0)",0
yeah i hate this shit .,Medium,Aggressive,Profane and Negative,Frustrated,"(0, 0, 0, 1, 0, 0, 0, 0, 0, 0, 0, 0, 1, 0, 0, 0, 0, 0, 0, 0, 0, 0, 0, 1, 0, 0, 0, 0, 0, 0, 0, 0, 1, 0, 0, 0, 0)",0
yeah they don t give a fuck .,Medium,Indifferent,Vulgar,Apathetic,"(0, 0, 0, 0, 0, 0, 0, 0, 0, 0, 0, 0, 0, 0, 0, 0, 0, 0, 0, 0, 0, 0, 0, 0, 0, 0, 0, 0, 0, 0, 0, 1, 0, 0, 0, 0, 0)",2
yeh well ban me fukkers fuck you morons,High,Aggressive,Vulgar and Insulting,Defiant,"(1, 0, 0, 1, 0, 0, 0, 0, 0, 0, 0, 0, 0, 0, 0, 0, 0, 0, 0, 0, 0, 0, 0, 0, 0, 0, 0, 0, 0, 0, 0, 1, 0, 0, 1, 0, 0)",2
yet to this day people still believe the bullshit lies about clinton .,High,Angry,Profane and Accusatory,Hostile,"(0, 1, 0, 0, 0, 1, 0, 0, 0, 0, 0, 0, 0, 0, 0, 0, 0, 0, 0, 0, 0, 0, 0, 0, 0, 0, 0, 0, 0, 0, 0, 0, 1, 1, 0, 0, 0)",0
you 've lost your fucking chances .,High,Aggressive,Vulgar and Insulting,Hostile,"(1, 1, 0, 1, 0, 0, 0, 0, 0, 0, 0, 0, 0, 0, 0, 0, 0, 0, 0, 0, 0, 0, 0, 0, 0, 0, 0, 0, 0, 0, 0, 1, 0, 0, 0, 0, 0)",1
you are a bit of a dick,High,Aggressive,Insulting,Hostile,"(1, 1, 0, 1, 0, 0, 0, 0, 0, 0, 0, 0, 0, 0, 0, 0, 0, 0, 0, 0, 0, 0, 0, 0, 0, 0, 0, 0, 0, 0, 0, 0, 0, 0, 0, 0, 0)",1
you don 't remember that shit ?,Medium,Accusatory,Informal and Vulgar,Frustrated,"(0, 0, 0, 0, 0, 1, 0, 0, 0, 0, 0, 0, 0, 0, 0, 0, 0, 0, 0, 0, 0, 0, 0, 1, 0, 0, 0, 0, 0, 0, 0, 1, 0, 0, 0, 0, 0)",2
you have got to be insane .,Medium,Derogatory,Confrontational and Insulting,Disparaging,"(1, 0, 1, 0, 1, 0, 0, 1, 0, 0, 0, 0, 0, 0, 0, 0, 0, 0, 0, 0, 0, 0, 0, 0, 0, 0, 0, 0, 0, 0, 0, 0, 0, 0, 0, 0, 0)",0
you have no fucking idea youtu.,Medium,Aggressive,Profane and Disrespectful,Contemptuous,"(0, 0, 0, 1, 0, 0, 0, 0, 1, 0, 0, 0, 0, 0, 0, 1, 0, 0, 0, 0, 0, 0, 0, 0, 0, 0, 0, 0, 0, 0, 0, 0, 1, 0, 0, 0, 0)",0
you leave me alone asshole !,High,Hostile,Confrontational and Insulting,Aggressive,"(1, 1, 1, 1, 0, 0, 0, 0, 0, 0, 0, 0, 0, 0, 0, 0, 0, 0, 0, 0, 0, 0, 0, 0, 0, 0, 0, 0, 0, 0, 0, 0, 0, 0, 0, 0, 0)",1
you trolls still wouldn t give a shit .,High,Aggressive,Rude and Disparaging,Contemptuous,"(0, 0, 0, 1, 0, 0, 0, 1, 1, 0, 0, 0, 0, 0, 0, 0, 0, 0, 0, 0, 0, 0, 0, 0, 0, 0, 0, 0, 0, 0, 0, 0, 0, 0, 0, 0, 0)",0
your types of examples are idiotic .,High,Derisive,Confrontational and Insulting,Contemptuous,"(1, 0, 1, 0, 0, 0, 0, 0, 1, 0, 0, 0, 0, 0, 0, 0, 0, 1, 0, 0, 0, 0, 0, 0, 0, 0, 0, 0, 0, 0, 0, 0, 0, 0, 0, 0, 0)",0
"yup , keep government shit off air unless you want shit to get worse .",Medium,Frustrated,Vulgar and Aggressive,Cynical,"(0, 0, 0, 1, 0, 0, 0, 0, 0, 0, 0, 0, 0, 0, 0, 0, 0, 0, 0, 0, 0, 0, 0, 1, 0, 0, 0, 0, 0, 0, 0, 1, 0, 0, 0, 0, 0)",2
"yurope is fucking awesome that way , yeah s .",Low,Casual,Informal and Profane,Positive,"(0, 0, 0, 0, 0, 0, 0, 0, 0, 0, 0, 0, 0, 0, 0, 0, 0, 0, 0, 0, 0, 0, 0, 0, 0, 0, 0, 0, 1, 0, 0, 0, 1, 0, 0, 0, 1)",0
"DAMNIT, not much to vandalize here so I won't even bother.",Medium,Frustrated,Crude and Dismissive,Disruptive,"(0, 0, 0, 0, 0, 0, 0, 0, 0, 0, 1, 0, 0, 0, 0, 0, 0, 0, 0, 0, 0, 0, 0, 1, 0, 0, 0, 0, 0, 0, 0, 0, 0, 0, 0, 0, 0)",0
"Oh no, I'll have to refresh my IP address, that'll take a whole 2 minutes, fags.",High,Sarcastic,Offensive and Disparaging,Contemptuous,"(0, 0, 0, 0, 0, 0, 0, 1, 1, 1, 0, 0, 0, 0, 0, 0, 1, 0, 0, 0, 0, 0, 0, 0, 0, 0, 0, 0, 0, 0, 0, 0, 0, 0, 0, 0, 0)",0
"If you don't stop bitching, I'll change my IP address and come back again.",High,Threatening,Vulgar and Aggressive,Hostile,"(0, 1, 0, 1, 0, 0, 0, 0, 0, 0, 0, 0, 0, 0, 0, 0, 0, 0, 0, 0, 0, 1, 0, 0, 0, 0, 0, 0, 0, 0, 0, 1, 0, 0, 0, 0, 0)",2
Who the fuck do you think you are Wang Chung?,High,Aggressive,Vulgar and Insulting,Hostile,"(1, 1, 0, 1, 0, 0, 0, 0, 0, 0, 0, 0, 0, 0, 0, 0, 0, 0, 0, 0, 0, 0, 0, 0, 0, 0, 0, 0, 0, 0, 0, 1, 0, 0, 0, 0, 0)",1
How fucking dare you delete my entry about the hungarian goalkepper.,High,Aggressive,Confrontational and Profane,Angry,"(0, 0, 1, 1, 0, 0, 0, 0, 0, 0, 0, 0, 0, 0, 0, 0, 0, 0, 0, 0, 0, 0, 0, 0, 0, 0, 0, 0, 0, 0, 0, 0, 1, 1, 0, 0, 0)",1
Why hasn't Alitalia been removed from the alliance due to its piss-poor customer service?,Medium,Critical,Informal and Vulgar,Disdainful,"(0, 0, 0, 0, 0, 0, 1, 0, 0, 0, 0, 0, 0, 0, 1, 0, 0, 0, 0, 0, 0, 0, 0, 0, 0, 0, 0, 0, 0, 0, 0, 1, 0, 0, 0, 0, 0)",2
"Cease and desist your anti-Zionist bigotry, or I will report you to the authorities.",High,Threatening and Accusatory,Confrontational and Authoritative,Hostile,"(0, 1, 1, 0, 0, 1, 0, 0, 0, 0, 0, 0, 0, 0, 0, 0, 0, 0, 0, 0, 0, 1, 0, 0, 0, 0, 0, 0, 0, 0, 0, 0, 0, 0, 0, 0, 0)",1
"Goths listen to Gothic rock, not to baby pop. If you want you can find sources for every shit.",High,Disdainful,Derogatory and Dismissive,Contemptuous,"(0, 0, 0, 0, 1, 0, 0, 0, 1, 0, 1, 0, 0, 0, 1, 0, 0, 0, 0, 0, 0, 0, 0, 0, 0, 0, 0, 0, 0, 0, 0, 0, 0, 0, 0, 0, 0)",0
I hate free speech it is shit.,High,Aggressive,Confrontational and Crude,Hostile,"(0, 1, 1, 1, 0, 0, 0, 0, 0, 0, 0, 0, 0, 0, 0, 0, 0, 0, 0, 0, 0, 0, 0, 0, 0, 0, 0, 0, 0, 0, 0, 0, 0, 0, 0, 0, 0)",1
YOU NEED TO STOP PISSING OTHERS OFF,Medium,Aggressive,Informal and Confrontational,Critical,"(0, 0, 1, 1, 0, 0, 1, 0, 0, 0, 0, 0, 0, 0, 0, 0, 0, 0, 0, 0, 0, 0, 0, 0, 0, 0, 0, 0, 0, 0, 0, 0, 0, 0, 0, 0, 0)",1
i just started it 5 minutes before you started this crap. give it some time.,Medium,Frustrated,Informal and Disrespectful,Impatient,"(0, 0, 0, 0, 0, 0, 0, 0, 0, 0, 0, 0, 0, 0, 0, 1, 0, 0, 0, 0, 0, 0, 0, 1, 0, 0, 0, 0, 0, 0, 0, 0, 0, 0, 0, 0, 0)",0
"i don't care, and i will ignore this warning, Fucking Bitch",High,Aggressive,Profane and Defiant,Hostile,"(0, 1, 0, 1, 0, 0, 0, 0, 0, 0, 0, 0, 0, 0, 0, 0, 0, 0, 0, 0, 0, 0, 0, 0, 0, 0, 0, 0, 0, 0, 0, 0, 1, 0, 1, 0, 0)",1
Shut up. I can do what the fuck I want.,High,Aggressive,Confrontational and Vulgar,Defiant,"(0, 0, 1, 1, 0, 0, 0, 0, 0, 0, 0, 0, 0, 0, 0, 0, 0, 0, 0, 0, 0, 0, 0, 0, 0, 0, 0, 0, 0, 0, 0, 1, 0, 0, 1, 0, 0)",2
Fuck off You are NOT an administrator. You DON'T have the authority to tell me what to do.,High,Aggressive,Confrontational and Disrespectful,Hostile,"(0, 1, 1, 1, 0, 0, 0, 0, 0, 0, 0, 0, 0, 0, 0, 1, 0, 0, 0, 0, 0, 0, 0, 0, 0, 0, 0, 0, 0, 0, 0, 0, 0, 0, 0, 0, 0)",1
"Minority Breeder Breeder is a significant person and you went and deleted the page started for him, nice job dipshit.",High,Sarcastic and Aggressive,Confrontational and Insulting,Angry,"(1, 0, 1, 1, 0, 0, 0, 0, 0, 1, 0, 0, 0, 0, 0, 0, 0, 0, 0, 0, 0, 0, 0, 0, 0, 0, 0, 0, 0, 0, 0, 0, 0, 1, 0, 0, 0)",1
"Hey asshole, its my article, if i want to delete it i will!",High,Aggressive,Confrontational and Insulting,Hostile,"(1, 1, 1, 1, 0, 0, 0, 0, 0, 0, 0, 0, 0, 0, 0, 0, 0, 0, 0, 0, 0, 0, 0, 0, 0, 0, 0, 0, 0, 0, 0, 0, 0, 0, 0, 0, 0)",1
"This bot is seriously driving us crazy This image exists, I must kill it!",High,Aggressive,Violent and Critical,Hostile,"(0, 1, 0, 1, 0, 0, 1, 0, 0, 0, 0, 0, 0, 0, 0, 0, 0, 0, 0, 0, 0, 0, 0, 0, 0, 0, 0, 0, 0, 0, 0, 0, 0, 0, 0, 0, 0)",1
"I don't give a fuck, so jack in",High,Aggressive,Profane and Confrontational,Indifferent and Disrespectful,"(0, 0, 1, 1, 0, 0, 0, 0, 0, 0, 0, 0, 0, 0, 0, 1, 0, 0, 0, 0, 0, 0, 0, 0, 0, 0, 0, 0, 0, 0, 0, 0, 1, 0, 0, 0, 0)",1
Then you're both blind and retarded.,High,Aggressive,Confrontational and Insulting,Hostile,"(1, 1, 1, 1, 0, 0, 0, 0, 0, 0, 0, 0, 0, 0, 0, 0, 0, 0, 0, 0, 0, 0, 0, 0, 0, 0, 0, 0, 0, 0, 0, 0, 0, 0, 0, 0, 0)",1
Have you been fucking living under a rock?,High,Aggressive,Vulgar and Insulting,Contemptuous,"(1, 0, 0, 1, 0, 0, 0, 0, 1, 0, 0, 0, 0, 0, 0, 0, 0, 0, 0, 0, 0, 0, 0, 0, 0, 0, 0, 0, 0, 0, 0, 1, 0, 0, 0, 0, 0)",2
who changes shit which shouldn't be changed,Medium,Accusatory,Coarse and Disparaging,Disapproving,"(0, 0, 0, 0, 0, 1, 0, 1, 0, 0, 0, 1, 0, 0, 0, 0, 0, 0, 0, 0, 0, 0, 0, 0, 0, 0, 0, 0, 0, 0, 0, 0, 0, 0, 0, 0, 0)",0
"I will help you, little idiot.",High,Condescending,Insulting and Patronizing,Hostile,"(1, 1, 0, 0, 0, 0, 0, 0, 0, 0, 0, 0, 0, 1, 0, 0, 0, 0, 0, 0, 0, 0, 0, 0, 0, 0, 0, 0, 0, 0, 0, 0, 0, 0, 0, 0, 0)",1
"I will do Whatever i want and it is my right, what is both of yous Problem Asshole.",High,Aggressive,Confrontational and Offensive,Hostile,"(0, 1, 1, 1, 0, 0, 0, 0, 0, 0, 0, 0, 0, 0, 0, 0, 1, 0, 0, 0, 0, 0, 0, 0, 0, 0, 0, 0, 0, 0, 0, 0, 0, 0, 0, 0, 0)",1
