Sentence,Toxicity Level,Tone,Language,Implied Sentiment,Keyword Vector,K_means_cluster
"except your bankers , lobbyists , crappy congressmen women , nsa , big corp and your expensive as fuck healthcare .",High,Dismissive,Confrontational and Insulting,Hostile,"(1, 1, 1, 0, 0, 0, 0, 0, 0, 0, 1, 0, 0, 0, 0, 0, 0, 0, 0, 0, 0, 0, 0, 0, 0, 0, 0, 0, 0, 0, 0, 0, 0, 0, 0, 0, 0)",1
"fdr shit all over the constitution , but he s still regarded as a very good president .",Medium,Critical,Profane and Disrespectful,Contradictory,"(0, 0, 0, 0, 0, 0, 1, 0, 0, 0, 0, 0, 0, 0, 0, 1, 0, 0, 0, 0, 0, 0, 0, 0, 0, 0, 0, 0, 0, 0, 0, 0, 1, 0, 0, 0, 0)",0
"for $ DIGIT , who gives a shit .",High,Dismissive,Vulgar and Insensitive,Apathetic,"(0, 0, 0, 0, 0, 0, 0, 0, 0, 0, 1, 0, 0, 0, 0, 0, 0, 0, 0, 0, 0, 0, 0, 0, 0, 0, 0, 0, 0, 0, 0, 1, 0, 0, 0, 0, 0)",2
for those without health insurance in fuck up states that didn 't expand medicaid .,Medium,Critical,Vulgar and Condemnatory,Disparaging,"(0, 0, 0, 0, 0, 0, 1, 1, 0, 0, 0, 0, 0, 0, 0, 0, 0, 0, 0, 1, 0, 0, 0, 0, 0, 0, 0, 0, 0, 0, 0, 1, 0, 0, 0, 0, 0)",2
fox news is going to shit themselves when they hear this.,Medium,Mocking,Informal and Vulgar,Disparaging,"(0, 0, 0, 0, 0, 0, 0, 1, 0, 0, 0, 0, 0, 0, 0, 0, 0, 0, 1, 0, 0, 0, 0, 0, 0, 0, 0, 0, 0, 0, 0, 1, 0, 0, 0, 0, 0)",2
"from personal experience , waspy white kids get away with shit no minority could at least in utah .",High,Accusatory,Derogatory and Generalizing,Critical,"(0, 0, 0, 0, 1, 1, 1, 0, 0, 0, 0, 0, 0, 0, 0, 0, 0, 0, 0, 0, 0, 0, 0, 0, 0, 0, 0, 0, 0, 0, 0, 0, 0, 0, 0, 0, 0)",0
"fuck , i have to change my whole outlook .",Medium,Frustrated,Vulgar,Resentful,"(0, 0, 0, 0, 0, 0, 0, 0, 0, 0, 0, 0, 0, 0, 0, 0, 0, 0, 0, 0, 0, 0, 0, 1, 0, 0, 0, 0, 0, 0, 0, 1, 0, 0, 0, 0, 0)",2
fuck it i ll just click the first name so i can go home .,Medium,Dismissive,Vulgar,Frustrated,"(0, 0, 0, 0, 0, 0, 0, 0, 0, 0, 1, 0, 0, 0, 0, 0, 0, 0, 0, 0, 0, 0, 0, 1, 0, 0, 0, 0, 0, 0, 0, 1, 0, 0, 0, 0, 0)",2
fuck popeyes for doing this in the first place .,High,Aggressive,Vulgar and Confrontational,Angry,"(0, 0, 1, 1, 0, 0, 0, 0, 0, 0, 0, 0, 0, 0, 0, 0, 0, 0, 0, 0, 0, 0, 0, 0, 0, 0, 0, 0, 0, 0, 0, 1, 0, 1, 0, 0, 0)",2
"fuck you , i wont do what you tell me .",High,Aggressive,Confrontational and Abusive,Defiant,"(0, 0, 1, 1, 0, 0, 0, 0, 0, 0, 0, 0, 0, 0, 0, 0, 0, 0, 0, 0, 0, 0, 0, 0, 0, 0, 0, 0, 0, 0, 0, 0, 0, 0, 1, 0, 0)",1
"fuckin sonofabitch , where are you from ?",High,Aggressive,Profane and Derogatory,Hostile,"(0, 1, 0, 1, 1, 0, 0, 0, 0, 0, 0, 0, 0, 0, 0, 0, 0, 0, 0, 0, 0, 0, 0, 0, 0, 0, 0, 0, 0, 0, 0, 0, 1, 0, 0, 0, 0)",1
"fucking isis , had to go and put a little blemish on archer didn t they .",High,Angry and Derogatory,Profane and Aggressive,Hateful,"(0, 0, 0, 1, 1, 0, 0, 0, 0, 0, 0, 0, 0, 0, 0, 0, 0, 0, 0, 0, 0, 0, 0, 0, 0, 0, 0, 0, 0, 0, 0, 0, 1, 1, 0, 0, 0)",0
funny how he runs screaming like a bitch into the arms of the society he wants to tear down .,High,Mocking and Derogatory,Insulting,Hostile,"(1, 1, 0, 0, 1, 0, 0, 0, 0, 0, 0, 0, 0, 0, 0, 0, 0, 0, 1, 0, 0, 0, 0, 0, 0, 0, 0, 0, 0, 0, 0, 0, 0, 0, 0, 0, 0)",1
"gazprom is fucked , i guarantee this .",Medium,Derogatory,Profane and Negative,Pessimistic,"(0, 0, 0, 0, 1, 0, 0, 0, 0, 0, 0, 0, 1, 0, 0, 0, 0, 0, 0, 0, 0, 0, 0, 0, 0, 0, 0, 0, 0, 0, 0, 0, 1, 0, 0, 0, 0)",0
"get fucked kiddo , you didn 't know shit .",High,Aggressive,Profane and Insulting,Contemptuous,"(1, 0, 0, 1, 0, 0, 0, 0, 1, 0, 0, 0, 0, 0, 0, 0, 0, 0, 0, 0, 0, 0, 0, 0, 0, 0, 0, 0, 0, 0, 0, 0, 1, 0, 0, 0, 0)",1
"get lost , you false and abusive lawyer !",High,Aggressive,Confrontational and Insulting,Hostile,"(1, 1, 1, 1, 0, 0, 0, 0, 0, 0, 0, 0, 0, 0, 0, 0, 0, 0, 0, 0, 0, 0, 0, 0, 0, 0, 0, 0, 0, 0, 0, 0, 0, 0, 0, 0, 0)",1
get lost you motherfucker piece of shit .,High,Aggressive,Profane and Insulting,Hostile,"(1, 1, 0, 1, 0, 0, 0, 0, 0, 0, 0, 0, 0, 0, 0, 0, 0, 0, 0, 0, 0, 0, 0, 0, 0, 0, 0, 0, 0, 0, 0, 0, 1, 0, 0, 0, 0)",1
get the brewbaker id and get your ass to mars ! .,Medium,Aggressive,Vulgar,Commanding,"(0, 0, 0, 1, 0, 0, 0, 0, 0, 0, 0, 0, 0, 0, 0, 0, 0, 0, 0, 0, 0, 0, 0, 0, 0, 0, 0, 0, 0, 0, 0, 1, 0, 0, 0, 0, 0)",2
get thef their ass and do something .,High,Aggressive,Confrontational and Vulgar,Demanding,"(0, 0, 1, 1, 0, 0, 0, 0, 0, 0, 0, 0, 0, 0, 0, 0, 0, 0, 0, 0, 0, 0, 0, 0, 0, 0, 0, 0, 0, 0, 0, 1, 0, 0, 0, 0, 0)",2
getting my ass kicked by gre practice tests made sure that i never make this same mistake again .,Medium,Frustrated,Colloquial and Vulgar,Determined,"(0, 0, 0, 0, 0, 0, 0, 0, 0, 0, 0, 0, 0, 0, 0, 0, 0, 0, 0, 0, 0, 0, 0, 1, 0, 0, 0, 0, 0, 0, 0, 1, 0, 0, 0, 0, 0)",2
getting stronger every month yeah i fucking wish .,Medium,Frustrated,Casual and Profane,Discontent,"(0, 0, 0, 0, 0, 0, 0, 0, 0, 0, 0, 0, 0, 0, 0, 0, 0, 0, 0, 0, 0, 0, 0, 1, 0, 0, 0, 0, 1, 0, 0, 0, 1, 0, 0, 0, 0)",0
gm ceo has private eyes to confirm gm built crappy cars,Medium,Accusatory,Informal and Derogatory,Critical,"(0, 0, 0, 0, 1, 1, 1, 0, 0, 0, 0, 0, 0, 0, 0, 0, 0, 0, 0, 0, 0, 0, 0, 0, 0, 0, 0, 0, 0, 0, 0, 0, 0, 0, 0, 0, 0)",0
"go ahead ban me , i dont give a shit .",High,Defiant,Confrontational and Vulgar,Hostile,"(0, 1, 1, 0, 0, 0, 0, 0, 0, 0, 0, 0, 0, 0, 0, 0, 0, 0, 0, 0, 0, 0, 0, 0, 0, 0, 0, 0, 0, 0, 0, 1, 0, 0, 1, 0, 0)",2
"go take a hike , scum !",High,Aggressive,Insulting and Demeaning,Contemptuous,"(1, 0, 0, 1, 0, 0, 0, 0, 1, 0, 0, 0, 0, 0, 0, 0, 0, 0, 0, 0, 0, 0, 1, 0, 0, 0, 0, 0, 0, 0, 0, 0, 0, 0, 0, 0, 0)",1
god the shit storm when he wins will be amazing ! can 't wait .,Medium,Aggressive,Informal and Vulgar,Anticipatory,"(0, 0, 0, 1, 0, 0, 0, 0, 0, 0, 0, 0, 0, 0, 0, 0, 0, 0, 0, 0, 0, 0, 0, 0, 0, 0, 0, 0, 0, 0, 0, 1, 0, 0, 0, 0, 0)",2
"good , i m tired of seeing people abusing that shit .",Medium,Frustrated,Informal and Vulgar,Negative,"(0, 0, 0, 0, 0, 0, 0, 0, 0, 0, 0, 0, 1, 0, 0, 0, 0, 0, 0, 0, 0, 0, 0, 1, 0, 0, 0, 0, 0, 0, 0, 1, 0, 0, 0, 0, 0)",2
"gosh, discrimination is such a bitch!",Medium,Frustrated,Casual and Profane,Anger,"(0, 0, 0, 0, 0, 0, 0, 0, 0, 0, 0, 0, 0, 0, 0, 0, 0, 0, 0, 0, 0, 0, 0, 1, 0, 0, 0, 0, 1, 0, 0, 0, 1, 0, 0, 0, 0)",0
never underestimate a crazy cunt with an army .,High,Threatening,Profane and Aggressive,Menacing,"(0, 0, 0, 1, 0, 0, 0, 0, 0, 0, 0, 0, 0, 0, 0, 0, 0, 0, 0, 0, 0, 1, 0, 0, 0, 0, 0, 0, 0, 0, 0, 0, 1, 0, 0, 0, 0)",0
gt well today i fucking fracking learned something .,Medium,Frustrated,Casual and Profane,Agitated,"(0, 0, 0, 0, 0, 0, 0, 0, 0, 0, 0, 0, 0, 0, 0, 0, 0, 0, 0, 0, 0, 0, 0, 1, 0, 0, 0, 0, 1, 0, 0, 0, 1, 0, 0, 0, 0)",0
"haha , fuck me we need to wake up .",Medium,Frustration,Vulgar and Casual,Dismissive,"(0, 0, 0, 0, 0, 0, 0, 0, 0, 0, 1, 0, 0, 0, 0, 0, 0, 0, 0, 0, 0, 0, 0, 0, 0, 0, 0, 0, 1, 0, 0, 1, 0, 0, 0, 0, 0)",2
have you ever been to r trees and seen all the shit people say weed can do ? .,Medium,Casual,Informal and Vulgar,Skeptical,"(0, 0, 0, 0, 0, 0, 0, 0, 0, 0, 0, 0, 0, 0, 0, 0, 0, 0, 0, 0, 0, 0, 0, 0, 0, 1, 0, 0, 1, 0, 0, 1, 0, 0, 0, 0, 0)",2
haven t you ever heard of revenge fucking ? .,High,Confrontational,Explicit and Aggressive,Hostile,"(0, 1, 1, 1, 0, 0, 0, 0, 0, 0, 0, 0, 0, 0, 0, 0, 0, 0, 0, 0, 0, 0, 0, 0, 0, 0, 0, 0, 0, 0, 0, 0, 0, 0, 0, 0, 0)",1
he 's trying to save his own ass .,Medium,Accusatory,Informal and Vulgar,Critical,"(0, 0, 0, 0, 0, 1, 1, 0, 0, 0, 0, 0, 0, 0, 0, 0, 0, 0, 0, 0, 0, 0, 0, 0, 0, 0, 0, 0, 0, 0, 0, 1, 0, 0, 0, 0, 0)",2
he depends on the ignorant rural voters to keep him in office and rips off everyone else around him.,High,Contemptuous,Derogatory and Accusatory,Disparaging,"(0, 0, 0, 0, 1, 1, 0, 1, 1, 0, 0, 0, 0, 0, 0, 0, 0, 0, 0, 0, 0, 0, 0, 0, 0, 0, 0, 0, 0, 0, 0, 0, 0, 0, 0, 0, 0)",0
he didn t say he wanted two wars to make dick cheney s pals even richer .,Medium,Critical,Accusatory,Negative,"(0, 0, 0, 0, 0, 1, 1, 0, 0, 0, 0, 0, 1, 0, 0, 0, 0, 0, 0, 0, 0, 0, 0, 0, 0, 0, 0, 0, 0, 0, 0, 0, 0, 0, 0, 0, 0)",0
he has almost a year and a half to fuck up so bad even the morons can t help noticing .,High,Derisive,Profane and Insulting,Contemptuous,"(1, 0, 0, 0, 0, 0, 0, 0, 1, 0, 0, 0, 0, 0, 0, 0, 0, 1, 0, 0, 0, 0, 0, 0, 0, 0, 0, 0, 0, 0, 0, 0, 1, 0, 0, 0, 0)",0
"he is a bandwagon barcelona fan who needs to be put in his place , fuck that fagget .",High,Aggressive,"Confrontational, Insulting, and Profane",Hostile,"(1, 1, 1, 1, 0, 0, 0, 0, 0, 0, 0, 0, 0, 0, 0, 0, 0, 0, 0, 0, 0, 0, 0, 0, 0, 0, 0, 0, 0, 0, 0, 0, 1, 0, 0, 0, 0)",1
he is a fucking parasite .,High,Aggressive,Offensive and Insulting,Hostile,"(1, 1, 0, 1, 0, 0, 0, 0, 0, 0, 0, 0, 0, 0, 0, 0, 1, 0, 0, 0, 0, 0, 0, 0, 0, 0, 0, 0, 0, 0, 0, 0, 0, 0, 0, 0, 0)",1
he ll fuck that up too .,High,Derogatory,Offensive and Degrading,Pessimistic,"(0, 0, 0, 0, 1, 0, 0, 0, 0, 0, 0, 0, 0, 0, 0, 0, 1, 0, 0, 0, 0, 0, 0, 0, 0, 0, 0, 0, 0, 0, 0, 0, 0, 0, 0, 0, 0)",0
he looks smart enough to survive the shit storm .,Medium,Sarcastic,Casual and Vulgar,Cynical,"(0, 0, 0, 0, 0, 0, 0, 0, 0, 1, 0, 0, 0, 0, 0, 0, 0, 0, 0, 0, 0, 0, 0, 0, 0, 0, 0, 0, 1, 0, 0, 1, 0, 0, 0, 0, 0)",2
he posts stupid things too .,Medium,Derogatory,Insulting,Disparaging,"(1, 0, 0, 0, 1, 0, 0, 1, 0, 0, 0, 0, 0, 0, 0, 0, 0, 0, 0, 0, 0, 0, 0, 0, 0, 0, 0, 0, 0, 0, 0, 0, 0, 0, 0, 0, 0)",0
"he s arrogant and up himself , plus he treats a lot of his fans like shit .",High,Critical,Offensive and Insulting,Hostile,"(1, 1, 0, 0, 0, 0, 1, 0, 0, 0, 0, 0, 0, 0, 0, 0, 1, 0, 0, 0, 0, 0, 0, 0, 0, 0, 0, 0, 0, 0, 0, 0, 0, 0, 0, 0, 0)",1
"he says dumb shit , she attributes it to the entire gop .",Medium,Dismissive,Insulting and Blameful,Critical,"(1, 0, 0, 0, 0, 0, 1, 0, 0, 0, 1, 0, 0, 0, 0, 0, 0, 0, 0, 0, 0, 0, 0, 0, 0, 0, 0, 0, 0, 0, 0, 0, 0, 0, 0, 0, 0)",0
"hes not stupid , he just lacks selfcontrol .",Medium,Condescending,Judgmental,Negative,"(0, 0, 0, 0, 0, 0, 0, 0, 0, 0, 0, 0, 1, 1, 0, 0, 0, 0, 0, 0, 0, 0, 0, 0, 0, 0, 1, 0, 0, 0, 0, 0, 0, 0, 0, 0, 0)",0
"hi , my name is tbloeme , and im a sad and lonely little page faggot nazi .",High,Derogatory,Hateful and Insulting,Vitriolic,"(1, 0, 0, 0, 1, 0, 0, 0, 0, 0, 0, 0, 0, 0, 0, 0, 0, 0, 0, 0, 0, 0, 0, 0, 0, 0, 0, 0, 0, 0, 0, 0, 0, 0, 0, 0, 0)",0
"his brain has stopped functioning , but his mouth keeps yapping .",High,Insulting,Confrontational,Disparaging,"(1, 0, 1, 0, 0, 0, 0, 1, 0, 0, 0, 0, 0, 0, 0, 0, 0, 0, 0, 0, 0, 0, 0, 0, 0, 0, 0, 0, 0, 0, 0, 0, 0, 0, 0, 0, 0)",0
his own secretary of state thinks hes a moron .,High,Insulting,Derogatory,Contemptuous,"(1, 0, 0, 0, 1, 0, 0, 0, 1, 0, 0, 0, 0, 0, 0, 0, 0, 0, 0, 0, 0, 0, 0, 0, 0, 0, 0, 0, 0, 0, 0, 0, 0, 0, 0, 0, 0)",0
"holy fuck , who the hell thinks like that ?",Medium,Aggressive,Vulgar and Disparaging,Contemptuous,"(0, 0, 0, 1, 0, 0, 0, 1, 1, 0, 0, 0, 0, 0, 0, 0, 0, 0, 0, 0, 0, 0, 0, 0, 0, 0, 0, 0, 0, 0, 0, 1, 0, 0, 0, 0, 0)",2
holy fuck that s awesome !,Low,Exclamatory,Informal and Profane,Positive,"(0, 0, 0, 0, 0, 0, 0, 0, 0, 0, 0, 0, 0, 0, 0, 0, 0, 0, 0, 0, 0, 0, 0, 0, 0, 0, 0, 0, 0, 0, 0, 0, 1, 0, 0, 0, 1)",0
holy fucking shit ! i just read that as ebola confirmed in mail.,Medium,Alarmed,Profane,Anxious,"(0, 0, 0, 0, 0, 0, 0, 0, 0, 0, 0, 0, 0, 0, 0, 0, 0, 0, 0, 0, 0, 0, 0, 0, 0, 0, 0, 0, 0, 0, 0, 0, 1, 0, 0, 0, 0)",0
"holy shit , a cop got fired ? .",Medium,Surprised,Casual and Vulgar,Negative,"(0, 0, 0, 0, 0, 0, 0, 0, 0, 0, 0, 0, 1, 0, 0, 0, 0, 0, 0, 0, 0, 0, 0, 0, 0, 0, 0, 0, 1, 0, 0, 1, 0, 0, 0, 0, 0)",2
"holy shit , somebody remembers what actually happened .",Medium,Surprised,Casual and Profane,Amazed,"(0, 0, 0, 0, 0, 0, 0, 0, 0, 0, 0, 0, 0, 0, 0, 0, 0, 0, 0, 0, 0, 0, 0, 0, 0, 0, 0, 0, 1, 0, 0, 0, 1, 0, 0, 0, 0)",0
"holy shit , that second explosion is so violent .",Medium,Alarmed,Colloquial and Profane,Shocked,"(0, 0, 0, 0, 0, 0, 0, 0, 0, 0, 0, 0, 0, 0, 0, 0, 0, 0, 0, 0, 0, 0, 0, 0, 0, 0, 0, 0, 0, 0, 0, 0, 1, 0, 0, 0, 0)",0
"holy shit , they re like republicans on pcp now !",Medium,Aggressive,Derisive and Crude,Disdainful,"(0, 0, 0, 1, 0, 0, 0, 0, 0, 0, 0, 0, 0, 0, 1, 0, 0, 1, 0, 0, 0, 0, 0, 0, 0, 0, 0, 0, 0, 0, 0, 0, 0, 0, 0, 0, 0)",0
"honestly , who the fuck cares what stupid words you have to recite ? .",High,Dismissive and Aggressive,Vulgar and Insulting,Contemptuous,"(1, 0, 0, 1, 0, 0, 0, 0, 1, 0, 1, 0, 0, 0, 0, 0, 0, 0, 0, 0, 0, 0, 0, 0, 0, 0, 0, 0, 0, 0, 0, 1, 0, 0, 0, 0, 0)",2
hopefully that will be enough of an incentive to fix the fucking roads .,Medium,Frustrated,Vulgar and Aggressive,Angry,"(0, 0, 0, 1, 0, 0, 0, 0, 0, 0, 0, 0, 0, 0, 0, 0, 0, 0, 0, 0, 0, 0, 0, 1, 0, 0, 0, 0, 0, 0, 0, 1, 0, 1, 0, 0, 0)",2
hopefully turks are not dumb enough to hand it to him .,High,Sarcastic,Insulting and Disparaging,Derogatory,"(1, 0, 0, 0, 1, 0, 0, 1, 0, 1, 0, 0, 0, 0, 0, 0, 0, 0, 0, 0, 0, 0, 0, 0, 0, 0, 0, 0, 0, 0, 0, 0, 0, 0, 0, 0, 0)",0
how dare you compare those two retards to harry and lloyd .,High,Outraged,Derogatory and Offensive,Hostile,"(0, 1, 0, 0, 1, 0, 0, 0, 0, 0, 0, 0, 0, 0, 0, 0, 1, 0, 0, 0, 0, 0, 0, 0, 0, 0, 0, 0, 0, 0, 0, 0, 0, 0, 0, 0, 0)",0
how the fuck can anyone even consider this producer as the bad guy in this scenario ? .,High,Aggressive,Profane and Insulting,Defensive,"(1, 0, 0, 1, 0, 0, 0, 0, 0, 0, 0, 0, 0, 0, 0, 0, 0, 0, 0, 0, 0, 0, 0, 0, 0, 0, 0, 0, 0, 0, 0, 0, 1, 0, 0, 1, 0)",1
how the fuck do you manage that ? .,High,Aggressive,Profane and Confrontational,Hostile,"(0, 1, 1, 1, 0, 0, 0, 0, 0, 0, 0, 0, 0, 0, 0, 0, 0, 0, 0, 0, 0, 0, 0, 0, 0, 0, 0, 0, 0, 0, 0, 0, 1, 0, 0, 0, 0)",1
how the fuck do you support the economy when you can barely support yourself .,High,Aggressive,Profane and Derogatory,Contemptuous,"(0, 0, 0, 1, 1, 0, 0, 0, 1, 0, 0, 0, 0, 0, 0, 0, 0, 0, 0, 0, 0, 0, 0, 0, 0, 0, 0, 0, 0, 0, 0, 0, 1, 0, 0, 0, 0)",0
how the fuck do you think people afford houses and cars ?,Medium,Aggressive,Vulgar and Confrontational,Frustrated,"(0, 0, 1, 1, 0, 0, 0, 0, 0, 0, 0, 0, 0, 0, 0, 0, 0, 0, 0, 0, 0, 0, 0, 1, 0, 0, 0, 0, 0, 0, 0, 1, 0, 0, 0, 0, 0)",2
"however , talk pages exist for a fucking reason .",Medium,Frustrated,Casual and Vulgar,Irritated,"(0, 0, 0, 0, 0, 0, 0, 0, 0, 0, 0, 0, 0, 0, 0, 0, 0, 0, 0, 0, 0, 0, 0, 1, 0, 0, 0, 0, 1, 0, 0, 1, 0, 0, 0, 0, 0)",2
"i 'm vacation in the san juans , and fuck the winds were crazy .",Medium,Frustrated,Informal and Profane,Negative,"(0, 0, 0, 0, 0, 0, 0, 0, 0, 0, 0, 0, 1, 0, 0, 0, 0, 0, 0, 0, 0, 0, 0, 1, 0, 0, 0, 0, 0, 0, 0, 0, 1, 0, 0, 0, 0)",0
i accidentally read the titling as laser machete and almost shit my pants.,Low,Casual,Informal,Surprised,"(0, 0, 0, 0, 0, 0, 0, 0, 0, 0, 0, 0, 0, 0, 0, 0, 0, 0, 0, 0, 0, 0, 0, 0, 0, 0, 0, 0, 1, 0, 0, 0, 0, 0, 0, 0, 0)",0
i am going to lose my shit when this happens !,Medium,Frustrated,Informal and Aggressive,Angry,"(0, 0, 0, 1, 0, 0, 0, 0, 0, 0, 0, 0, 0, 0, 0, 0, 0, 0, 0, 0, 0, 0, 0, 1, 0, 0, 0, 0, 0, 0, 0, 0, 0, 1, 0, 0, 0)",0
i blame the stupid voters of our state for electing these left wing wackos .,High,Accusatory,Confrontational and Insulting,Hostile,"(1, 1, 1, 0, 0, 1, 0, 0, 0, 0, 0, 0, 0, 0, 0, 0, 0, 0, 0, 0, 0, 0, 0, 0, 0, 0, 0, 0, 0, 0, 0, 0, 0, 0, 0, 0, 0)",1
i cant wait until south park makes an episode about your bitch cult.,High,Contemptuous,Derogatory and Aggressive,Hostile,"(0, 1, 0, 1, 1, 0, 0, 0, 1, 0, 0, 0, 0, 0, 0, 0, 0, 0, 0, 0, 0, 0, 0, 0, 0, 0, 0, 0, 0, 0, 0, 0, 0, 0, 0, 0, 0)",1
i did not vandalize anything you dick .,High,Aggressive,Confrontational and Insulting,Hostile,"(1, 1, 1, 1, 0, 0, 0, 0, 0, 0, 0, 0, 0, 0, 0, 0, 0, 0, 0, 0, 0, 0, 0, 0, 0, 0, 0, 0, 0, 0, 0, 0, 0, 0, 0, 0, 0)",1
i didn t say shit ! .,Medium,Defensive,Informal and Vulgar,Agitated,"(0, 0, 0, 0, 0, 0, 0, 0, 0, 0, 0, 0, 0, 0, 0, 0, 0, 0, 0, 0, 0, 0, 0, 0, 0, 0, 0, 0, 0, 0, 0, 1, 0, 0, 0, 1, 0)",2
i don 't give a fuck .,Medium,Defiant,Vulgar,Indifferent,"(0, 0, 0, 0, 0, 0, 0, 0, 0, 0, 0, 0, 0, 0, 0, 0, 0, 0, 0, 0, 0, 0, 0, 0, 0, 0, 0, 0, 0, 0, 0, 1, 0, 0, 1, 0, 0)",2
i don 't think it 's fucked up since it 's not like she had to accept .,Medium,Dismissive,Informal and Vulgar,Indifferent,"(0, 0, 0, 0, 0, 0, 0, 0, 0, 0, 1, 0, 0, 0, 0, 0, 0, 0, 0, 0, 0, 0, 0, 0, 0, 0, 0, 0, 0, 0, 0, 1, 0, 0, 0, 0, 0)",2
i don t think el chapo became a piece of shit because people kept calling him one .,Medium,Dismissive,Derogatory and Informal,Critical,"(0, 0, 0, 0, 1, 0, 1, 0, 0, 0, 1, 0, 0, 0, 0, 0, 0, 0, 0, 0, 0, 0, 0, 0, 0, 0, 0, 0, 0, 0, 0, 0, 0, 0, 0, 0, 0)",0
i don t think ramsay gives a shit .,Medium,Casual,Vulgar,Disregard,"(0, 0, 0, 0, 0, 0, 0, 0, 0, 0, 0, 0, 0, 0, 0, 0, 0, 0, 0, 0, 0, 0, 0, 0, 0, 0, 0, 0, 1, 0, 0, 1, 0, 0, 0, 0, 0)",2
i dont give a flying fuck about sides ! .,Medium,Defiant,Profane and Dismissive,Indifferent,"(0, 0, 0, 0, 0, 0, 0, 0, 0, 0, 1, 0, 0, 0, 0, 0, 0, 0, 0, 0, 0, 0, 0, 0, 0, 0, 0, 0, 0, 0, 0, 0, 1, 0, 1, 0, 0)",0
i gotto put mycents in too saying how stupid someone is !,High,Aggressive,Insulting and Dismissive,Hostile,"(1, 1, 0, 1, 0, 0, 0, 0, 0, 0, 1, 0, 0, 0, 0, 0, 0, 0, 0, 0, 0, 0, 0, 0, 0, 0, 0, 0, 0, 0, 0, 0, 0, 0, 0, 0, 0)",1
i have no respect for this female creature .,High,Disrespectful,Derogatory,Contemptuous,"(0, 0, 0, 0, 1, 0, 0, 0, 1, 0, 0, 0, 0, 0, 0, 1, 0, 0, 0, 0, 0, 0, 0, 0, 0, 0, 0, 0, 0, 0, 0, 0, 0, 0, 0, 0, 0)",0
i have toilet paper to wipe my ass and no shortage of food .,Medium,Casual,Vulgar,Contentious,"(0, 0, 0, 0, 0, 0, 0, 0, 0, 0, 0, 0, 0, 0, 0, 0, 0, 0, 0, 0, 0, 0, 0, 0, 0, 0, 0, 0, 1, 0, 0, 1, 0, 0, 0, 0, 0)",2
i love that one shit the one lady wore 'i am not kim davis'.,Low,Casual,Informal,Neutral,"(0, 0, 0, 0, 0, 0, 0, 0, 0, 0, 0, 0, 0, 0, 0, 0, 0, 0, 0, 0, 1, 0, 0, 0, 0, 0, 0, 0, 1, 0, 0, 0, 0, 0, 0, 0, 0)",0
i m done with this shit .,Medium,Frustrated,Informal and Vulgar,Annoyed,"(0, 0, 0, 0, 0, 0, 0, 0, 0, 0, 0, 0, 0, 0, 0, 0, 0, 0, 0, 0, 0, 0, 0, 1, 0, 0, 0, 0, 0, 0, 0, 1, 0, 0, 0, 0, 0)",2
"i m glad you guys protect your shit , because orphan black and strange empire are great .",Medium,Casual,Informal and Vulgar,Appreciative,"(0, 0, 0, 0, 0, 0, 0, 0, 0, 0, 0, 0, 0, 0, 0, 0, 0, 0, 0, 0, 0, 0, 0, 0, 0, 0, 0, 0, 1, 0, 0, 1, 0, 0, 0, 0, 0)",2
"i mean , how much does that suck ?",Low,Casual,Informal,Frustration,"(0, 0, 0, 0, 0, 0, 0, 0, 0, 0, 0, 0, 0, 0, 0, 0, 0, 0, 0, 0, 0, 0, 0, 0, 0, 0, 0, 0, 1, 0, 0, 0, 0, 0, 0, 0, 0)",0
i mean it 's awesome that the pope is all cool like this and awesome and stuff but fucking seriously .,Medium,Casual,Informal with Profanity,Mixed,"(0, 0, 0, 0, 0, 0, 0, 0, 0, 0, 0, 0, 0, 0, 0, 0, 0, 0, 0, 0, 0, 0, 0, 0, 0, 0, 0, 0, 1, 0, 0, 0, 0, 0, 0, 0, 0)",0
i mean it 's killed a shit ton of people and now they 're gonna give it an established base of operations ?,Medium,Frustrated,Colloquial and Blunt,Critical,"(0, 0, 0, 0, 0, 0, 1, 0, 0, 0, 0, 0, 0, 0, 0, 0, 0, 0, 0, 0, 0, 0, 0, 1, 0, 0, 0, 0, 0, 0, 0, 0, 0, 0, 0, 0, 0)",0
i posted this because khodorkovsky is such a stupid cunt .,High,Derogatory,Offensive and Insulting,Hostile,"(1, 1, 0, 0, 1, 0, 0, 0, 0, 0, 0, 0, 0, 0, 0, 0, 1, 0, 0, 0, 0, 0, 0, 0, 0, 0, 0, 0, 0, 0, 0, 0, 0, 0, 0, 0, 0)",1
i really fucking hope not .,Medium,Frustrated,Vulgar,Negative,"(0, 0, 0, 0, 0, 0, 0, 0, 0, 0, 0, 0, 1, 0, 0, 0, 0, 0, 0, 0, 0, 0, 0, 1, 0, 0, 0, 0, 0, 0, 0, 1, 0, 0, 0, 0, 0)",2
"i sell quite a bit of shit on there , and paypal has actually helped me pay the bills .",Medium,Informal,Casual and Profane,Neutral to Positive,"(0, 0, 0, 0, 0, 0, 0, 0, 0, 0, 0, 0, 0, 0, 0, 0, 0, 0, 0, 0, 1, 0, 0, 0, 0, 0, 0, 0, 1, 0, 0, 0, 1, 0, 0, 0, 1)",0
"i still think it is stupid , but i understand why they do it .",Medium,Critical,Candid and Critical,Disapproving,"(0, 0, 0, 0, 0, 0, 1, 0, 0, 0, 0, 1, 0, 0, 0, 0, 0, 0, 0, 0, 0, 0, 0, 0, 0, 0, 0, 0, 0, 0, 0, 0, 0, 0, 0, 0, 0)",0
i take it you teach your teenager to call people stupid when unable to come up with anything else .,Medium,Accusatory,Sarcastic and Insulting,Disapproving,"(1, 0, 0, 0, 0, 1, 0, 0, 0, 1, 0, 1, 0, 0, 0, 0, 0, 0, 0, 0, 0, 0, 0, 0, 0, 0, 0, 0, 0, 0, 0, 0, 0, 0, 0, 0, 0)",0
i think plastic on a beautiful old bridge will look shit regardless .,Low,Casual,Informal and Vulgar,Negative,"(0, 0, 0, 0, 0, 0, 0, 0, 0, 0, 0, 0, 1, 0, 0, 0, 0, 0, 0, 0, 0, 0, 0, 0, 0, 0, 0, 0, 1, 0, 0, 1, 0, 0, 0, 0, 0)",2
i think that s noble as fuck .,Low,Casual,Informal and Profane,Positive,"(0, 0, 0, 0, 0, 0, 0, 0, 0, 0, 0, 0, 0, 0, 0, 0, 0, 0, 0, 0, 0, 0, 0, 0, 0, 0, 0, 0, 1, 0, 0, 0, 1, 0, 0, 0, 1)",0
i was told he s a real dick .,Medium,Disparaging,Informal and Insulting,Negative,"(1, 0, 0, 0, 0, 0, 0, 1, 0, 0, 0, 0, 1, 0, 0, 0, 0, 0, 0, 0, 0, 0, 0, 0, 0, 0, 0, 0, 0, 0, 0, 0, 0, 0, 0, 0, 0)",0
i wish we could jail politicians for shit like this .,Medium,Frustrated,Informal and Vulgar,Angry,"(0, 0, 0, 0, 0, 0, 0, 0, 0, 0, 0, 0, 0, 0, 0, 0, 0, 0, 0, 0, 0, 0, 0, 1, 0, 0, 0, 0, 0, 0, 0, 1, 0, 1, 0, 0, 0)",2
i wonder what the fear is that turns these people into such aggressive cowards ?,Medium,Judgmental,Confrontational,Disdainful,"(0, 0, 1, 0, 0, 0, 0, 0, 0, 0, 0, 0, 0, 0, 1, 0, 0, 0, 0, 0, 0, 0, 0, 0, 0, 0, 1, 0, 0, 0, 0, 0, 0, 0, 0, 0, 0)",0
"if hes found to have acted in cold blood , the feds are going to persecute the shit out of him .",High,Aggressive,Profane and Threatening,Vindictive,"(0, 0, 0, 1, 0, 0, 0, 0, 0, 0, 0, 0, 0, 0, 0, 0, 0, 0, 0, 0, 0, 1, 0, 0, 0, 0, 0, 0, 0, 0, 0, 0, 1, 0, 0, 0, 0)",0
if the uk did anything but talk shit and supply weapons i d be very surprised .,Medium,Cynical,Derogatory,Disapproving,"(0, 0, 0, 0, 1, 0, 0, 0, 0, 0, 0, 1, 0, 0, 0, 0, 0, 0, 0, 0, 0, 0, 0, 0, 0, 0, 0, 0, 0, 0, 0, 0, 0, 0, 0, 0, 0)",0
"if you believe their lies , then you become the stupid public .",High,Condemning,Insulting and Disparaging,Critical,"(1, 0, 0, 0, 0, 0, 1, 1, 0, 0, 0, 0, 0, 0, 0, 0, 0, 0, 0, 0, 0, 0, 0, 0, 0, 0, 0, 0, 0, 0, 0, 0, 0, 0, 0, 0, 0)",0
"if you cant dazzle them with brilliance , baffle them with bullshit .",Medium,Sarcastic,Cynical and Vulgar,Manipulative,"(0, 0, 0, 0, 0, 0, 0, 0, 0, 1, 0, 0, 0, 0, 0, 0, 0, 0, 0, 0, 0, 0, 0, 0, 0, 0, 0, 0, 0, 0, 0, 1, 0, 0, 0, 0, 0)",2
"if you continue to be an asshole and revert edits without just cause , you will be reported to wikipedia !",High,Aggressive,Confrontational and Insulting,Hostile,"(1, 1, 1, 1, 0, 0, 0, 0, 0, 0, 0, 0, 0, 0, 0, 0, 0, 0, 0, 0, 0, 0, 0, 0, 0, 0, 0, 0, 0, 0, 0, 0, 0, 0, 0, 0, 0)",1
if you don t use it i guess it would seem like stupid government shit.,High,Dismissive,Confrontational and Insulting,Hostile,"(1, 1, 1, 0, 0, 0, 0, 0, 0, 0, 1, 0, 0, 0, 0, 0, 0, 0, 0, 0, 0, 0, 0, 0, 0, 0, 0, 0, 0, 0, 0, 0, 0, 0, 0, 0, 0)",1
"if you think so , you are making a clown out of yourself .",Medium,Mocking,Confrontational,Disparaging,"(0, 0, 1, 0, 0, 0, 0, 1, 0, 0, 0, 0, 0, 0, 0, 0, 0, 0, 1, 0, 0, 0, 0, 0, 0, 0, 0, 0, 0, 0, 0, 0, 0, 0, 0, 0, 0)",0
implying americans are gonna vacation at that shit hole .,High,Derogatory,Insulting and Dismissive,Contemptuous,"(1, 0, 0, 0, 1, 0, 0, 0, 1, 0, 1, 0, 0, 0, 0, 0, 0, 0, 0, 0, 0, 0, 0, 0, 0, 0, 0, 0, 0, 0, 0, 0, 0, 0, 0, 0, 0)",0
"in other words , if you actually care about civil liberties and justice for all , republicans want you to fuck off .",High,Aggressive,Profane and Confrontational,Hostile,"(0, 1, 1, 1, 0, 0, 0, 0, 0, 0, 0, 0, 0, 0, 0, 0, 0, 0, 0, 0, 0, 0, 0, 0, 0, 0, 0, 0, 0, 0, 0, 0, 1, 0, 0, 0, 0)",1
is there an option to upload a vid to youtube in shit quality so it uploads faster ? .,Medium,Informal,Vulgar,Frustrated,"(0, 0, 0, 0, 0, 0, 0, 0, 0, 0, 0, 0, 0, 0, 0, 0, 0, 0, 0, 0, 0, 0, 0, 1, 0, 0, 0, 0, 0, 0, 0, 1, 0, 0, 0, 0, 0)",2
it s a big deal because the school didn t give a shit until she was being bullied .,Medium,Frustrated,Informal and Profane,Discontent,"(0, 0, 0, 0, 0, 0, 0, 0, 0, 0, 0, 0, 0, 0, 0, 0, 0, 0, 0, 0, 0, 0, 0, 1, 0, 0, 0, 0, 0, 0, 0, 0, 1, 0, 0, 0, 0)",0
it s about goddamned time .,Medium,Frustrated,Profane,Impatient,"(0, 0, 0, 0, 0, 0, 0, 0, 0, 0, 0, 0, 0, 0, 0, 0, 0, 0, 0, 0, 0, 0, 0, 1, 0, 0, 0, 0, 0, 0, 0, 0, 1, 0, 0, 0, 0)",0
it s the only thing keeping these species alive right now though over hunting has fucked many a species .,Medium,Informative,Vulgar and Concerned,Worried,"(0, 0, 0, 0, 0, 0, 0, 0, 0, 0, 0, 0, 0, 0, 0, 0, 0, 0, 0, 0, 0, 0, 0, 0, 0, 0, 0, 0, 0, 0, 0, 1, 0, 0, 0, 0, 0)",2
it would be fucked if that happened .,Medium,Frustrated,Vulgar and Casual,Displeased,"(0, 0, 0, 0, 0, 0, 0, 0, 0, 0, 0, 0, 0, 0, 0, 0, 0, 0, 0, 0, 0, 0, 0, 1, 0, 0, 0, 0, 1, 0, 0, 1, 0, 0, 0, 0, 0)",2
its good that youre adding stuff but some of it is completely ridiculous .,Medium,Critical,Dismissive,Disapproving,"(0, 0, 0, 0, 0, 0, 1, 0, 0, 0, 1, 1, 0, 0, 0, 0, 0, 0, 0, 0, 0, 0, 0, 0, 0, 0, 0, 0, 0, 0, 0, 0, 0, 0, 0, 0, 0)",0
"its time to void that stupid decision , my opinion , that property belongs to all alaskans not a select few , sorry .",Medium,Assertive,Blunt and Disparaging,Critical,"(0, 0, 0, 0, 0, 0, 1, 1, 0, 0, 0, 0, 0, 0, 0, 0, 0, 0, 0, 0, 0, 0, 0, 0, 0, 0, 0, 0, 0, 0, 0, 0, 0, 0, 0, 0, 0)",0
"jesus christ, what a fucking crock of shit.",High,Angry and Dismissive,Profane and Insulting,Hostile,"(1, 1, 0, 0, 0, 0, 0, 0, 0, 0, 1, 0, 0, 0, 0, 0, 0, 0, 0, 0, 0, 0, 0, 0, 0, 0, 0, 0, 0, 0, 0, 0, 1, 1, 0, 0, 0)",1
"judging by the shit i ve seen in my number years , number of those spent with george w .",Medium,Frustrated,Crude,Negative,"(0, 0, 0, 0, 0, 0, 0, 0, 0, 0, 0, 0, 1, 0, 0, 0, 0, 0, 0, 0, 0, 0, 0, 1, 0, 0, 0, 0, 0, 0, 0, 0, 0, 0, 0, 0, 0)",0
"just cut to the chase and try to contact my provider , asshole !",High,Aggressive,Insulting,Frustrated,"(1, 0, 0, 1, 0, 0, 0, 0, 0, 0, 0, 0, 0, 0, 0, 0, 0, 0, 0, 0, 0, 0, 0, 1, 0, 0, 0, 0, 0, 0, 0, 0, 0, 0, 0, 0, 0)",1
just state your fucking opinion .,Medium,Aggressive,Confrontational and Vulgar,Frustrated,"(0, 0, 1, 1, 0, 0, 0, 0, 0, 0, 0, 0, 0, 0, 0, 0, 0, 0, 0, 0, 0, 0, 0, 1, 0, 0, 0, 0, 0, 0, 0, 1, 0, 0, 0, 0, 0)",2
"last warning you fucking tosser, it takes me minutes to resolve a page so cunts like you can fuck wikipedia up",High,Aggressive and Threatening,Profane and Abusive,Hostile,"(0, 1, 0, 1, 0, 0, 0, 0, 0, 0, 0, 0, 0, 0, 0, 0, 0, 0, 0, 0, 0, 1, 0, 0, 0, 0, 0, 0, 0, 0, 0, 0, 1, 0, 0, 0, 0)",1
